Mathematics,[SymbolicComputation](https://en.wikipedia.org/wiki/Symbolic_computation),SymEngine.jl,https://github.com/symengine/SymEngine.jl,Julia wrappers of SymEngine.
Mathematics,Calculus&[AppliedMath](http://en.wikipedia.org/wiki/Applied_mathematics),ad4julia,https://github.com/bsxfan/ad4julia,Some automatic diffferentiation coding experiments in Julia.
Mathematics,Calculus&[AppliedMath](http://en.wikipedia.org/wiki/Applied_mathematics),Calculus.jl,https://github.com/johnmyleswhite/Calculus.jl,Calculus package.
Mathematics,Calculus&[AppliedMath](http://en.wikipedia.org/wiki/Applied_mathematics),Calculus2.jl,https://github.com/johnmyleswhite/Calculus2.jl,A draft of a new interface for the Calculus package.
Mathematics,Calculus&[AppliedMath](http://en.wikipedia.org/wiki/Applied_mathematics),Cuba.jl,https://github.com/giordano/Cuba.jl,Library for multidimensional numerical integration with four independent algorithms: Vegas, Suave, Divonne, and Cuhre.
Mathematics,Calculus&[AppliedMath](http://en.wikipedia.org/wiki/Applied_mathematics),Einsum.jl,https://github.com/ahwillia/Einsum.jl,Einstein summation notation in julia.
Mathematics,Calculus&[AppliedMath](http://en.wikipedia.org/wiki/Applied_mathematics),FastPolynomials.jl,https://github.com/Jeffrey-Sarnoff/FastPolynomials.jl,Basic polynomials with Horner-like evaluation over x^2 and x.
Mathematics,Calculus&[AppliedMath](http://en.wikipedia.org/wiki/Applied_mathematics),FDM.jl,https://github.com/grasingerm/FDM.jl,Finite difference methods in Julia.
Mathematics,Calculus&[AppliedMath](http://en.wikipedia.org/wiki/Applied_mathematics),FeynmanKacSpde.jl,https://github.com/scidom/FeynmanKacSpde.jl,Feynman-Kac SPDE Inference.
Mathematics,Calculus&[AppliedMath](http://en.wikipedia.org/wiki/Applied_mathematics),HemirealFactorization.jl,https://github.com/timholy/HemirealFactorization.jl,Matrix factorizations over the hemireals.
Mathematics,Calculus&[AppliedMath](http://en.wikipedia.org/wiki/Applied_mathematics),HemirealNumbers.jl,https://github.com/timholy/HemirealNumbers.jl,Implementation of hemireal arithmetic for Julia.
Mathematics,Calculus&[AppliedMath](http://en.wikipedia.org/wiki/Applied_mathematics),HyperNumbers.jl,https://github.com/goedman/HyperNumbers.jl,Julia implementation of HyperNumbers.
Mathematics,Calculus&[AppliedMath](http://en.wikipedia.org/wiki/Applied_mathematics),IFastSum.jl,https://github.com/J-Sarnoff/IFastSum.jl,Accurate summation (Yuhang Zhao's iFastSum).
Mathematics,Calculus&[AppliedMath](http://en.wikipedia.org/wiki/Applied_mathematics),MINE.jl,https://github.com/zhmz90/MINE.jl,Julia wrapper for Maximal Information-based Nonparametric Exploration (MIC and MINE family).
Mathematics,Calculus&[AppliedMath](http://en.wikipedia.org/wiki/Applied_mathematics),pdetools.jl,https://github.com/GaZ3ll3/pdetools.jl,Toolbox for solving PDEs.
Mathematics,Calculus&[AppliedMath](http://en.wikipedia.org/wiki/Applied_mathematics),PowerSeries.jl,https://github.com/jwmerrill/PowerSeries.jl,Truncated Power Series for Julia, which exports a Series type that represents a truncated power series by its coefficients. You can do arithmetic on Series and apply functions to series just as you would Real or Complex numbers.
Mathematics,Calculus&[AppliedMath](http://en.wikipedia.org/wiki/Applied_mathematics),PolyMath.jl,https://github.com/cfbaptista/PolyMath.jl,a package for polynomial arithmetic, calculus, interpolation and quadrature algorithms implemented in Julia.
Mathematics,Calculus&[AppliedMath](http://en.wikipedia.org/wiki/Applied_mathematics),RAD.jl,https://github.com/adamkapor/RAD.jl,package defines a macro, @autodiff, for reverse-mode automatic differentiation.
Mathematics,Calculus&[AppliedMath](http://en.wikipedia.org/wiki/Applied_mathematics),RDE.jl,https://github.com/scidom/RDE.jl,Simulation and Bayesian Inference for Rough Differential Equations (RDEs).
Mathematics,Calculus&[AppliedMath](http://en.wikipedia.org/wiki/Applied_mathematics),ReverseDiffOverload.jl,https://github.com/LaurenceA/ReverseDiffOverload.jl,Reverse mode differentiation for pre-defined functions.
Mathematics,Calculus&[AppliedMath](http://en.wikipedia.org/wiki/Applied_mathematics),ReverseDiffSparse.jl,https://github.com/mlubin/ReverseDiffSparse.jl,Hessian algorithmic differentiation to compute hessian sparsity pattern.
Mathematics,Calculus&[AppliedMath](http://en.wikipedia.org/wiki/Applied_mathematics),ReverseDiffSparse2.jl,https://github.com/mlubin/ReverseDiffSparse2.jl,Prototype replacement for ReverseDiffSparse based on flattened out expression graphs.
Mathematics,Calculus&[AppliedMath](http://en.wikipedia.org/wiki/Applied_mathematics),ReverseDiffTape.jl,https://github.com/fqiang/ReverseDiffTape.jl,A Julia package for reverse mode differentiation on a tape.
Mathematics,Calculus&[AppliedMath](http://en.wikipedia.org/wiki/Applied_mathematics),RiemannComplexNumbers.jl,https://github.com/scheinerman/RiemannComplexNumbers.jl,The RiemannComplexNumbers module is an alternative Complex type for Julia (with a single complex infinity value).
Mathematics,Calculus&[AppliedMath](http://en.wikipedia.org/wiki/Applied_mathematics),TaylorSeries.jl,https://github.com/lbenet/TaylorSeries.jl,A julia package for Taylor expansions in one independent variable.
Mathematics,Resources,Calculus With Julia,https://github.com/CalculusWithJulia/CalculusWithJulia.github.io,Introductory Calculus with the Julia Programming Language.
Mathematics,Resources,n IJulia notebook showing [Taylor's method integration of the pendulum,http://nbviewer.ipython.org/gist/lbenet/616fa81f3c12c9cfcf97),
Mathematics,[DSP](https://en.wikipedia.org/wiki/Digital_signal_processing),APES.jl,https://github.com/codles/APES.jl,Amplitude and Phase Estimation of a Sinusoid.
Mathematics,[DSP](https://en.wikipedia.org/wiki/Digital_signal_processing),ChaosCommunications.jl,https://github.com/scidom/ChaosCommunications.jl,Simulation of chaos-based communication systems in Julia.
Mathematics,[DSP](https://en.wikipedia.org/wiki/Digital_signal_processing),CompressedSensing,https://github.com/dahlend/CompressedSensing,A basic compressed sensing algorithms available via the official package list with [documentation](http://compressedsensing.readthedocs.org/en/latest/).
Mathematics,[DSP](https://en.wikipedia.org/wiki/Digital_signal_processing),Fdtd.jl,https://github.com/nantonel/Fdtd.jl,3D Room Acoustics Finite Difference Time Domain (FDTD) Simulator.
Mathematics,[DSP](https://en.wikipedia.org/wiki/Digital_signal_processing),KDSP.jl,https://github.com/kofron/KDSP.jl,Yet another implementation of common DSP routines in Julia.
Mathematics,[DSP](https://en.wikipedia.org/wiki/Digital_signal_processing),KernelRecursiveLeastSquares.jl,https://github.com/the-moliver/KernelRecursiveLeastSquares.jl,Julia implementation of Kernel Recursive Least Squares algorithm.
Mathematics,[DSP](https://en.wikipedia.org/wiki/Digital_signal_processing),MDCT.jl,https://github.com/stevengj/MDCT.jl,This module computes the modified discrete cosine transform (MDCT) in the Julia language and the inverse transform (IMDCT), using the fast type-IV discrete cosine tranform (DCT-IV) functions in Julia (via FFTW).
Mathematics,[DSP](https://en.wikipedia.org/wiki/Digital_signal_processing),Multirate.jl,https://github.com/JayKickliter/Multirate.jl,Streaming polyphase DSP filters with sample rate conversion.
Mathematics,[DSP](https://en.wikipedia.org/wiki/Digital_signal_processing),RIM.jl,https://github.com/nantonel/RIM.jl,Julia implementation of a Room Acoustics Impulse Response Generator using the Randomized Image Method (RIM).
Mathematics,[DSP](https://en.wikipedia.org/wiki/Digital_signal_processing),wavechaos,https://github.com/amyascwk/wavechaos,
Mathematics,[DSP](https://en.wikipedia.org/wiki/Digital_signal_processing),WDSP.jl,https://github.com/pjabardo/WDSP.jl,Digital signal processing used in turbulence implemented in Julia.
Mathematics,Org-[JuliaDSP](https://github.com/JuliaDSP),DSP.jl,https://github.com/JuliaDSP/DSP.jl,The DSP ver-0.0.1 package, includes functions for periodogram estimation, generating window functions, filter design and FFT-based FIR filtering, works on Julia 0.2 and 0.3-prerelease. The [documentation is available via RTD.org](http://dspjl.readthedocs.org/en/latest/)
Mathematics,[FFT](https://en.wikipedia.org/wiki/Fast_Fourier_transform),CLFFT.jl,https://github.com/JuliaGPU/CLFFT.jl,Julia bindings for AMD's clFFT library.
Mathematics,[FFT](https://en.wikipedia.org/wiki/Fast_Fourier_transform),CUFFT.jl,https://github.com/JuliaGPU/CUFFT.jl,Wrapper for the CUDA FFT library.
Mathematics,[FFT](https://en.wikipedia.org/wiki/Fast_Fourier_transform),NFFT.jl,https://github.com/tknopp/NFFT.jl,Julia implementation of the NFFT : Non-equidistant Fast Fourier Transform.
Mathematics,[FFT](https://en.wikipedia.org/wiki/Fast_Fourier_transform),SnFFT.jl,https://github.com/GDPlumb/SnFFT.jl,A Julia package designed to facilitate harmonic analyis on the symmetric group of order n, denoted Sn.
Mathematics,[Functions](http://en.wikipedia.org/wiki/Category:Types_of_functions),BasisFunctions.jl,https://github.com/daanhb/BasisFunctions.jl,A collection of routines for working with a number of standard basis functions, mainly for use in the FrameFuns package.
Mathematics,[Functions](http://en.wikipedia.org/wiki/Category:Types_of_functions),Elliptic.jl,https://github.com/nolta/Elliptic.jl,Elliptic integral and Jacobi elliptic special functions.
Mathematics,[Functions](http://en.wikipedia.org/wiki/Category:Types_of_functions),FastAnonymous.jl,https://github.com/timholy/FastAnonymous.jl,Fast __anonymous functions__ for Julia.
Mathematics,[IntegralEquation](https://en.wikipedia.org/wiki/Integral_equation),ApproxFun,https://github.com/dlfivefifty/ApproxFun,Julia IFun Implementation is a package for approximating functions. It currently supports intervals, the real line, periodic intervals and the unit circle. It is heavily influenced by the Matlab package chebfun and the Mathematica package RHPackage.
Mathematics,[IntegralEquation](https://en.wikipedia.org/wiki/Integral_equation),SIE.jl,https://github.com/ApproxFun/SIE.jl,Julia package for solving singular integral equations and Riemann–Hilbert problems Julia package for solving singular integral equations and Riemann–Hilbert problems.
Mathematics,[IntegralEquation](https://en.wikipedia.org/wiki/Integral_equation),SingularIntegralEquations.jl,https://github.com/ApproxFun/SingularIntegralEquations.jl,Julia package for solving singular integral equations and Riemann–Hilbert problems.
Mathematics,[IntegralEquation](https://en.wikipedia.org/wiki/Integral_equation),WiltonInts84.jl,https://github.com/krcools/WiltonInts84.jl,Integrals of arbitrary powers of R over flat triangles.
Mathematics,Resources,NumericalMath’s documentation for Integration,http://hwborchers.lima-city.de/JuliaMeetup/numerical/integration.html),
Mathematics,[OrdinaryDifferentialEquation](http://en.wikipedia.org/wiki/Ordinary_differential_equation),AutoDiff.jl,https://github.com/scidom/AutoDiff.jl,Juila package for performing automatic differentiation.
Mathematics,[OrdinaryDifferentialEquation](http://en.wikipedia.org/wiki/Ordinary_differential_equation),DASSL.jl,https://github.com/pwl/DASSL.jl,An implementation of the Differential Algebraic System SoLver (DASSL) algorithm for solving algebraic differential equations.
Mathematics,[OrdinaryDifferentialEquation](http://en.wikipedia.org/wiki/Ordinary_differential_equation),DualNumbers2.jl,https://github.com/johnmyleswhite/DualNumbers2.jl,Another Julia implementation of dual numbers for automatic differentiation.
Mathematics,[OrdinaryDifferentialEquation](http://en.wikipedia.org/wiki/Ordinary_differential_equation),DynamicalSystems.jl,https://github.com/timothyrenner/DynamicalSystems.jl,A collection of Julia functions that produce the systems of ODEs for various dynamical systems.
Mathematics,[OrdinaryDifferentialEquation](http://en.wikipedia.org/wiki/Ordinary_differential_equation),IVPTestSuite.jl,https://github.com/mauro3/IVPTestSuite.jl,DE solver test suite of Ordinary differential equations (ODE) and algebraic differential equations (DAE).
Mathematics,[OrdinaryDifferentialEquation](http://en.wikipedia.org/wiki/Ordinary_differential_equation),ODEDSL.jl,https://github.com/AleMorales/ODEDSL.jl,Domain specific language to write ODE models with tests. Automatic code generation for Julia, R and CPP (via Rcpp).
Mathematics,[OrdinaryDifferentialEquation](http://en.wikipedia.org/wiki/Ordinary_differential_equation),odesolver,https://github.com/insideloop/odesolver,Collection of solvers for Ordinary Differential Equations.
Mathematics,[OrdinaryDifferentialEquation](http://en.wikipedia.org/wiki/Ordinary_differential_equation),RiemannHilbert.jl,https://github.com/dlfivefifty/RiemannHilbert.jl,Riemann–Hilbert problems, named after [Bernhard Riemann and David Hilbert](http://en.wikipedia.org/wiki/Riemann%E2%80%93Hilbert_problem), are a class of problems that arise in the study of differential equations in the complex plane.
Mathematics,Resources,FinealeBook.jl,https://github.com/goedman/FinealeBook.jl,Trying to understand Petr Krysl's FinEALE book.
Mathematics,Org-JuliaLang,AppleAccelerate.jl,https://github.com/JuliaLang/AppleAccelerate.jl,Julia interface to OS X's Accelerate framework.
Mathematics,Org-JuliaLang,ODE.jl,https://github.com/JuliaLang/ODE.jl,Assorted basic Ordinary Differential Equation solvers.
Mathematics,Org-JuliaLang,Options.jl,https://github.com/JuliaLang/Options.jl,A framework for providing optional arguments to functions.
Mathematics,Org-JuliaLang,Roots.jl,https://github.com/JuliaLang/Roots.jl,Root finding functions for Julia.
Mathematics,Org-JuliaLang,SortingAlgorithms.jl,https://github.com/JuliaLang/SortingAlgorithms.jl,extra sorting algorithms extending Julia's sorting API.
Mathematics,Org-JuliaLang,Sundials.jl,https://github.com/JuliaLang/Sundials.jl,A Julia package that interfaces to the Sundials library and includes a nonlinear solver (KINSOL), ODE's (CVODE), and DAE's (IDA).
Mathematics,Org-[JuliaDiff](http://www.juliadiff.org/),ReverseDiffSource.jl,https://github.com/JuliaDiff/ReverseDiffSource.jl,Automated differentiation by reverse accumulation. [Documentation](http://reversediffsourcejl.readthedocs.org/en/master/index.html).
Mathematics,Org-[JuliaDiff](http://www.juliadiff.org/),HyperDualNumbers.jl,https://github.com/JuliaDiff/HyperDualNumbers.jl,Hyper-Dual Numbers for Exact Second-Derivative Calculations, is structured similar to the DualNumbers package, which aims for complete support for HyperDual types for numerical functions within Julia's Base. Currently, basic mathematical operations and trigonometric functions are supported.
Mathematics,Org-[JuliaDiff](http://www.juliadiff.org/),ForwardDiff.jl,https://github.com/JuliaDiff/ForwardDiff.jl,Juila package for performing forward mode automatic differentiation.
Mathematics,Org-[JuliaDiff](http://www.juliadiff.org/),DualNumbers.jl,https://github.com/JuliaDiff/DualNumbers.jl,Julia package for representing dual numbers and for performing dual algebra.
Mathematics,Org-[JuliaDiff](http://www.juliadiff.org/),NDuals.jl,https://github.com/JuliaDiff/NDuals.jl,Experimental package for stack-allocated dual numbers with multiple epsilon components.
Mathematics,[GeneralDifferentialEquations](https://en.wikipedia.org/wiki/Differential_equation),DifferentialEquations.jl,https://github.com/ChrisRackauckas/DifferentialEquations.jl,Equations within the realm of this package include stochastic ordinary differential equations (SODEs or SDEs), stochastic partial differential equations (SPDEs), partial differential equations (with both finite difference and finite element methods), and differential delay equations.
Mathematics,[GeneralDifferentialEquations](https://en.wikipedia.org/wiki/Differential_equation),HPFEM.jl,https://github.com/pjabardo/HPFEM.jl,HP Finite elements in Julia.
Mathematics,[GeneralDifferentialEquations](https://en.wikipedia.org/wiki/Differential_equation),JFinEALE.jl,https://github.com/PetrKryslUCSD/JFinEALE.jl,A Finite Element Analysis Learning Environment (FinEALE) package for finite element analysis of continua. This toolkit is a redesign of the Matlab toolkit.
Mathematics,[GeneralDifferentialEquations](https://en.wikipedia.org/wiki/Differential_equation),Makhno.jl,https://github.com/pjabardo/Makhno.jl,Spectral element code implemented in Julia.
Mathematics,[SpecialFunctions](http://en.wikipedia.org/wiki/Category:Special_functions),LambertW.jl,https://github.com/jlapeyre/LambertW.jl,A package implementing the Lambert_W function and associated omega constant.
Mathematics,[DiscreteMath](https://en.wikipedia.org/wiki/Category:Discrete_mathematics),ClosedIntervals.jl,https://github.com/scheinerman/ClosedIntervals.jl,Closed intervals of the form [a,b].
Mathematics,[DiscreteMath](https://en.wikipedia.org/wiki/Category:Discrete_mathematics),DiscreteFactor.jl,https://github.com/wlbksy/DiscreteFactor.jl,Discrete factor and its operations in Probabilistic Graphical Models.
Mathematics,[DiscreteMath](https://en.wikipedia.org/wiki/Category:Discrete_mathematics),DiscreteInference.jl,https://github.com/lindahua/DiscreteInference.jl,Viterbi algorithm.
Mathematics,[DiscreteMath](https://en.wikipedia.org/wiki/Category:Discrete_mathematics),Intervals.jl,https://github.com/andrioni/Intervals.jl,A pure Julia reimplementation of MPFI, a multiple precision interval arithmetic library.
Mathematics,[DiscreteMath](https://en.wikipedia.org/wiki/Category:Discrete_mathematics),IntModN.jl,https://github.com/andrewcooke/IntModN.jl,Ring(s) of Integers Modulo-N.
Mathematics,[DiscreteMath](https://en.wikipedia.org/wiki/Category:Discrete_mathematics),IntsWithInfinty.jl,https://github.com/Jeffrey-Sarnoff/IntsWithInfinty.jl,Ints augmented with Infinity.
Mathematics,[DiscreteMath](https://en.wikipedia.org/wiki/Category:Discrete_mathematics),IPPMath.jl,https://github.com/lindahua/IPPMath.jl,A Julia package for vectorized math computation based on Intel IPP.
Mathematics,[DiscreteMath](https://en.wikipedia.org/wiki/Category:Discrete_mathematics),PermPlain.jl,https://github.com/jlapeyre/PermPlain.jl,Permutations implemented with plain data types - This package implements methods for manipulating permutations. The methods operate on data types in the Base module, or in modules providing generic data types.
Mathematics,[DiscreteMath](https://en.wikipedia.org/wiki/Category:Discrete_mathematics),Permutations.jl,https://github.com/scheinerman/Permutations.jl) by @scheinerma,Permutations class for Julia.
Mathematics,[DiscreteMath](https://en.wikipedia.org/wiki/Category:Discrete_mathematics),PermutationsA.jl,https://github.com/jlapeyre/PermutationsA.jl) by @jlapeyr,Permutation data types and methods.
Mathematics,[DiscreteMath](https://en.wikipedia.org/wiki/Category:Discrete_mathematics),PrimeSieve.jl,https://github.com/jlapeyre/PrimeSieve.jl,This package provides an interface to tables of primes and a sieve library.
Mathematics,[DiscreteMath](https://en.wikipedia.org/wiki/Category:Discrete_mathematics),RomanNumerals.jl,https://github.com/anthonyclays/RomanNumerals.jl,Support for Roman numerals in Julia.
Mathematics,[DiscreteMath](https://en.wikipedia.org/wiki/Category:Discrete_mathematics),Shannon.jl,https://github.com/kzahedi/Shannon.jl,Entropy, Mutual Information, KL-Divergence related to Shannon's information theory and functions to binarize data.
Mathematics,[DiscreteMath](https://en.wikipedia.org/wiki/Category:Discrete_mathematics),SimplePosets.jl,https://github.com/scheinerman/SimplePosets.jl,Simple partially ordered sets for Julia.
Mathematics,[DiscreteMath](https://en.wikipedia.org/wiki/Category:Discrete_mathematics),ZChop.jl,https://github.com/jlapeyre/ZChop.jl,This package replaces small numbers with zero, works on complex and rational numbers, arrays, and some other structures. The idea is for zchop to descend into structures, chopping numbers, and acting as the the identity on anything that can't be sensibly compared to eps.
Mathematics,[Geometry](http://en.wikipedia.org/wiki/Geometry),AffineSpaces.jl,https://github.com/anj1/AffineSpaces.jl,Uniform representation and computational geometry on affine subspaces (points, lines, planes, etc.) in Rⁿ.
Mathematics,[Geometry](http://en.wikipedia.org/wiki/Geometry),AffineTransforms.jl,https://github.com/timholy/AffineTransforms.jl,Computational geometry with affine transformations for conversion among different representations (mostly between rotation matrices and axis-angle).
Mathematics,[Geometry](http://en.wikipedia.org/wiki/Geometry),D4.jl,https://github.com/khwilson/D4.jl,An attempted implementation of Enumerating Quartic Dihedral Extensions of Q by Cohen, Diaz y Diaz, and Olivier in Composito Mathematica 2002.
Mathematics,[Geometry](http://en.wikipedia.org/wiki/Geometry),GeoAlg.jl,https://github.com/andrioni/GeoAlg.jl,A basic geometric
Mathematics,[Geometry](http://en.wikipedia.org/wiki/Geometry),Geometry2D.jl,https://github.com/mroughan/Geometry2D.jl,2D computational geometry package for Julia programming language.
Mathematics,[Geometry](http://en.wikipedia.org/wiki/Geometry),JointMoments.jl,https://github.com/tinybike/JointMoments.jl,Tensors and statistics for joint central moments.
Mathematics,[Geometry](http://en.wikipedia.org/wiki/Geometry),mbr.jl,https://github.com/intdxdt/mbr.jl,axis aligned minimum bounding box.
Mathematics,[Geometry](http://en.wikipedia.org/wiki/Geometry),Tau.jl,https://github.com/Aerlinger/Tau.jl,A simple module providing definition of the Tau constant.
Mathematics,[Geometry](http://en.wikipedia.org/wiki/Geometry),Tensors.jl,https://github.com/pgawron/Tensors.jl,Julia package for tensor decompositions.
Mathematics,[Geometry](http://en.wikipedia.org/wiki/Geometry),TensorOperations.jl,https://github.com/Jutho/TensorOperations.jl,Julia package for tensor contractions and related operations.
Mathematics,[AlgebraicGeometry](http://en.wikipedia.org/wiki/Category:Algebraic_geometry),CSoM.jl,https://github.com/goedman/CSoM.jl,Investigate Julia version of __Programming the FEM__ by I M Smith, D V Griffiths.
Mathematics,[AlgebraicGeometry](http://en.wikipedia.org/wiki/Category:Algebraic_geometry),EllipticCurves.jl,https://github.com/wwilson/EllipticCurves.jl,Elliptic Curves in Julia.
Mathematics,[AlgebraicGeometry](http://en.wikipedia.org/wiki/Category:Algebraic_geometry),khypot.jl,https://github.com/intdxdt/khypot.jl,k dimensional hypotenuse.
Mathematics,[AlgebraicGeometry](http://en.wikipedia.org/wiki/Category:Algebraic_geometry),FEM.jl,https://github.com/pjabardo/FEM.jl,Simple finite elements in Julia.
Mathematics,[AlgebraicGeometry](http://en.wikipedia.org/wiki/Category:Algebraic_geometry),ols.jl,https://github.com/forio/ols.jl,Julia type for multiple (multivariate) regression using OLS - Performs least squared regression on linear equations of multiple independent variables.
Mathematics,[AlgebraicGeometry](http://en.wikipedia.org/wiki/Category:Algebraic_geometry),SurfaceMesh.jl,https://github.com/michelk/SurfaceMesh.jl,A Finite element surface mesh manipulation library to work with polygon-surface-meshes.
Mathematics,[AlgebraicGeometry](http://en.wikipedia.org/wiki/Category:Algebraic_geometry),TrussPlotter.jl,https://github.com/sjkelly/TrussPlotter.jl,This is a package to plot trusses for finite element results.
Mathematics,[AlgebraicGeometry](http://en.wikipedia.org/wiki/Category:Algebraic_geometry),Vec.jl,https://github.com/tawheeler/Vec.jl,Provides 2D and 3D vector types for vector operations in Julia.
Mathematics,[ComputationalGeometry](https://en.wikipedia.org/wiki/Category:Computational_geometry),CDDLib.jl,https://github.com/blegat/CDDLib.jl,A wrapper for cdd, the library for polyhedra manipulation such as double description and Fourier-Motzkin elimination. This module can either be used in a __lower level__ using the API of cdd or using the higher level interface of Polyhedra.jl.
Mathematics,[ComputationalGeometry](https://en.wikipedia.org/wiki/Category:Computational_geometry),CHull.jl,https://github.com/davidavdav/CHull.jl,A Julia wrapper around a PyCall wrapper around the qhull Convex Hull library.
Mathematics,[ComputationalGeometry](https://en.wikipedia.org/wiki/Category:Computational_geometry),ConicHulls.jl,https://github.com/toivoh/ConicHulls.jl,Exact dynamic conic hulls of integer vectors.
Mathematics,[ComputationalGeometry](https://en.wikipedia.org/wiki/Category:Computational_geometry),ConvexHull.jl,https://github.com/joehuchette/ConvexHull.jl,A Julia library for polyhedral computations.
Mathematics,[ComputationalGeometry](https://en.wikipedia.org/wiki/Category:Computational_geometry),Polyhedra.jl,https://github.com/blegat/Polyhedra.jl,It provides an unified interface for Polyhedra Manipulation Libraries such as CDDLib.jl.
Mathematics,[SolidGeometry](https://en.wikipedia.org/wiki/Solid_geometry],Descartes.jl,https://github.com/FactoryOS/Descartes.jl,A research project into the representation of solid geometry.
Mathematics,[NumericalAnalysis](https://en.wikipedia.org/wiki/Category:Numerical_analysis),ApproXD.jl,https://github.com/floswald/ApproXD.jl,B-splines and linear high-dimensional approximators in multiple dimensions for Julia.
Mathematics,[NumericalAnalysis](https://en.wikipedia.org/wiki/Category:Numerical_analysis),Dopri.jl,https://github.com/helgee/Dopri.jl,A Julia wrapper for the DOPRI5 and DOP853 integrators.
Mathematics,[NumericalAnalysis](https://en.wikipedia.org/wiki/Category:Numerical_analysis),Dierckx.jl,https://github.com/kbarbary/Dierckx.jl ):: A Julia wrapper for the Dierckx Fortran library for spline fitting,
