AI,MACHINELEARNING,BackpropNeuralNet.jl,https://github.com/compressed/BackpropNeuralNet.jl,A neural network in Julia.
AI,MACHINELEARNING,BNMF.jl,https://github.com/r9y9/BNMF.jl,Gamma Process Non-negative Matrix Factorization (GaP-NMF).
AI,MACHINELEARNING,ConfidenceWeighted.jl,https://github.com/chezou/ConfidenceWeighted.jl,Confidence weighted, a machine learning algorithm.
AI,MACHINELEARNING,Contingency.jl,https://github.com/svs14/Contingency.jl,Assorted techniques for the purpose of enabling automated machine learning.
AI,MACHINELEARNING,Clustering.jl,https://github.com/johnmyleswhite/Clustering.jl,Basic functions for clustering data ==> k-means, dp-means, etc..
AI,MACHINELEARNING,DAI.jl,https://github.com/binarybana/DAI.jl,A julia binding to the C++ discrete approximate inference library for graphical models: libDAI.
AI,MACHINELEARNING,DecisionTree.jl,https://github.com/bensadeghi/DecisionTree.jl),
AI,MACHINELEARNING,DecisionTrees.jl,https://github.com/MikeInnes/DecisionTrees.jl),
AI,MACHINELEARNING,DeepQLearning.jl,https://github.com/Andy-P/DeepQLearning.jl,An implementation of DeepMind's Deep Q Learning algorithm described in _Playing Atari with Deep Reinforcement Learning_.
AI,MACHINELEARNING,Discretizers.jl,https://github.com/sisl/Discretizers.jl,A package to support discretization methods and mapping functions for data discretization and label maps.
AI,MACHINELEARNING,EGR.jl,https://github.com/stefanks/EGR.jl,The Stochastic Gradient (SG) algorithm for machine learning.
AI,MACHINELEARNING,ELM.jl,https://github.com/lepisma/ELM.jl,Extreme Learning Machines are a variant of Single-Hidden Layer Feedforward Networks (SLFNs) with a significant departure as their weights aren't iteratively tuned. This boosts the speed of neurals nets heavily.
AI,MACHINELEARNING,FeatureSelection.jl,https://github.com/Evizero/FeatureSelection.jl,Common measures and algorithms for feature selection.
AI,MACHINELEARNING,Flimsy.jl,https://github.com/thomlake/Flimsy.jl,Gradient based Machine Learning for Julia.
AI,MACHINELEARNING,FunctionalDataUtils.jl,https://github.com/rened/FunctionalDataUtils.jl,Utility functions for the FunctionalData package, mainly from the area of computer vision / machine learning.
AI,MACHINELEARNING,go.jl,https://github.com/dmrd/go.jl,A deep learning based Go bot implemented in Julia.
AI,MACHINELEARNING,GradientBoost.jl,https://github.com/svs14/GradientBoost.jl,Gradient boosting framework for Julia.
AI,MACHINELEARNING,GURLS.jl,https://github.com/joehuchette/GURLS.jl,A pure Julia port of the GURLS supervised learning library.
AI,MACHINELEARNING,Glmnet.jl,https://github.com/simonster/Glmnet.jl,Julia wrapper for fitting Lasso/ElasticNet GLM models using glmnet.
AI,MACHINELEARNING,HopfieldNets.jl,https://github.com/johnmyleswhite/HopfieldNets.jl,Discrete and continuous Hopfield networks in Julia.
AI,MACHINELEARNING,HSIC.jl,https://github.com/trappmartin/HSIC.jl,Julia implementations of the Hilbert-Schmidt Independence Criterion (HSIC).
AI,MACHINELEARNING,KaggleDigitRecognizer.jl,https://github.com/benhamner/KaggleDigitRecognizer.jl,Julia code for Kaggle's Digit Recognizer competition.
AI,MACHINELEARNING,KDTrees.jl,https://github.com/KristofferC/KDTrees.jl,KD Trees.
AI,MACHINELEARNING,Kernels.jl,https://github.com/trthatcher/Kernels.jl,A Julia package for Mercer kernels and Gramian matrix calculation/approximation functions used in kernel methods of machine learning.
AI,MACHINELEARNING,Knet.jl,https://github.com/denizyuret/Knet.jl,A machine learning module implemented in Julia.
AI,MACHINELEARNING,kNN.jl,https://github.com/johnmyleswhite/kNN.jl,The k-Nearest Neighbors algorithm in Julia.
AI,MACHINELEARNING,KSVM.jl,https://github.com/remusao/KSVM.jl) by @remusa,Kernel Support Vector Machine (SVM) written in Julia.
AI,MACHINELEARNING,KSVM.jl,https://github.com/Evizero/KSVM.jl) by @Evizer,Support Vector Machines in pure Julia.
AI,MACHINELEARNING,Ladder.jl,https://github.com/mrtzh/Ladder.jl,A reliable leaderboard algorithm for machine learning competitions.
AI,MACHINELEARNING,Learn.jl,https://github.com/Rory-Finnegan/Learn.jl,Base framework library for machine learning packages.
AI,MACHINELEARNING,LearnBase.jl,https://github.com/Evizero/LearnBase.jl,Abstractions for Julia Machine Learning Packages.
AI,MACHINELEARNING,liblinear.jl,https://github.com/tuzzeg/liblinear.jl,Liblinear binding to Julia.
AI,MACHINELEARNING,LIBSVM.jl,https://github.com/simonster/LIBSVM.jl,Julia bindings for LIBSVM.
AI,MACHINELEARNING,NMF.jl,https://github.com/lindahua/NMF.jl,A Julia package for non-negative matrix factorization (NMF).
AI,MACHINELEARNING,MachineLearning.jl,https://github.com/benhamner/MachineLearning.jl,is a Machine Learning library package that consolidates common machine learning algorithms written in pure Julia and presents a consistent API.
AI,MACHINELEARNING,Merlin.jl,https://github.com/hshindo/Merlin.jl,Flexible Deep Learning Framework in Julia.
AI,MACHINELEARNING,Milk.jl,https://github.com/faithlessfriend/Milk.jl,Machine Learning Kit.
AI,MACHINELEARNING,MLKernels.jl,https://github.com/trthatcher/MLKernels.jl,Mercer kernels and Gramian matrix calculation/approximation.
AI,MACHINELEARNING,Mocha.jl,https://github.com/pluskid/Mocha.jl,A Deep Learning framework for Julia, inspired by the C++ Deep Learning framework Caffe.
AI,MACHINELEARNING,ew tutorial on [unsupervised pre-training with stacked denoising auto-encoders,http://mochajl.readthedocs.org/en/latest/tutorial/mnist-sDA.html),
AI,MACHINELEARNING,n IJulia Notebook [demo of using pre-trained CNN on imagenet to do image classification,http://nbviewer.ipython.org/github/pluskid/Mocha.jl/blob/master/examples/ijulia/ilsvrc12/imagenet-classifier.ipynb),
AI,MACHINELEARNING,MochaTheano.jl,https://github.com/benmoran/MochaTheano.jl,Allow use of Theano for automatic differentiation within Mocha, via PyCall.
AI,MACHINELEARNING,Ollam.jl,https://github.com/mit-nlp/Ollam.jl,OLLAM = Online Learning of Linear Adaptatable Models.
AI,MACHINELEARNING,OnlineAI.jl,https://github.com/tbreloff/OnlineAI.jl,Machine learning for sequential/streaming data.  {Usable: 3, Robust: 3, Active: 3}
AI,MACHINELEARNING,Orchestra.jl,https://github.com/svs14/Orchestra.jl,Heterogeneous ensemble learning package for the Julia programming language.
AI,MACHINELEARNING,PrivateMultiplicativeWeights.jl,https://github.com/mrtzh/PrivateMultiplicativeWeights.jl,Differentially private synthetic data.
AI,MACHINELEARNING,ProjectiveDictionaryPairLearning.jl,https://github.com/quxiaofeng/ProjectiveDictionaryPairLearning.jl,Julia code for the paper S. Gu, L. Zhang, W. Zuo, and X. Feng, “Projective Dictionary Pair Learning for Pattern Classification,” In NIPS 2014.
AI,MACHINELEARNING,RegERMs.jl,https://github.com/BigCrunsh/RegERMs.jl,A package implementing several machine learning algorithms in a regularised empirical risk minimisation framework (SVMs, LogReg, Linear Regression) in Julia.
AI,MACHINELEARNING,SALSA.jl,https://github.com/jumutc/SALSA.jl,_S_oftware Lab for _A_dvanced Machine _L_earning and _S_tochastic _A_lgorithms is a native Julia implementation of the well known stochastic algorithms for linear and non-linear Support Vector Machines.
AI,MACHINELEARNING,SimpleML.jl,https://github.com/aviks/SimpleML.jl,Textbook implementations of some Machine Learning Algorithms in Julia.
AI,MACHINELEARNING,SFA.jl,https://github.com/makokal/SFA.jl,Implementation of the standard SFA (Slow Feature Analysis) algorithm (both linear and non-linear signal expansion) in Julia.
AI,MACHINELEARNING,SoftConfidenceWeighted.jl,https://github.com/IshitaTakeshi/SoftConfidenceWeighted.jl,Exact Soft Confidence-Weighted Learning.
AI,MACHINELEARNING,Strada.jl,https://github.com/pcmoritz/Strada.jl,A deep learning library for Julia based on Caffe.
AI,MACHINELEARNING,SupervisedLearning.jl,https://github.com/Evizero/SupervisedLearning.jl,Front-end interface for supervised machine learning.
AI,MACHINELEARNING,SVMLightLoader.jl,https://github.com/IshitaTakeshi/SVMLightLoader.jl,Loader of svmlight / liblinear format files.
AI,MACHINELEARNING,TSVD.jl,https://github.com/andreasnoack/TSVD.jl,Truncated singular value decomposition with partial reorthogonalization.
AI,MACHINELEARNING,YCaret.jl,https://github.com/EricChiang/YCaret.jl,Machine learning utility functions in Julia.
AI,Org-[JuliaML](https://github.com/JuliaML),ValueHistories.jl,https://github.com/JuliaML/ValueHistories.jl,Utilities to efficiently track learning curves or other optimization information.
AI,Resources,Examples from _Thoughtful Machine Learning_,https://github.com/thoughtfulml/examples),
AI,Resources,CIML,https://github.com/hal3/ciml,A Course in Machine Learning. This repository contains the source code for the CIML book (see http://ciml.info/) as well as any course materials that seem useful (slides, documents, labs, etc.).
AI,Resources,deepframeworks,https://github.com/zer0n/deepframeworks,An evaluation of Deep Learning Frameworks.
AI,Resources, [Machine Learning,http://work.caltech.edu/telecourse.html#lectures) course by Prof. Yaser Abu-Mostafa with videos on Youtube,
AI,Resources,ml_cheat_sheet,https://github.com/rcompton/ml_cheat_sheet,Supervised learning superstitions cheat sheet.
AI,Resources,Machine Learning Algorithm Cheat Sheet,http://www.lauradhamilton.com/machine-learning-algorithm-cheat-sheet) by Laura D Hamilton,
AI,Resources,machine-learning-cheat-sheet,https://github.com/soulmachine/machine-learning-cheat-sheet,Classical equations and diagrams in machine learning by @soulmachine.
AI,Resources,Machine Learning cheatsheet,http://eferm.com/machine-learning-cheat-sheet/),
AI,Resources,Big Data Machine Learning Patterns for Predictive Analytics,http://refcardz.dzone.com/refcardz/machine-learning-predictive) By Ricky Ho,
AI,Resources,juliastreetview,https://github.com/evq/juliastreetview,Updated sample code for the Kaggle Julia Street View Character Recognition Tutorial.
AI,Resources,ML4H.jl,https://github.com/johnmyleswhite/ML4H.jl,Machine Learning for Hackers in Julia.
AI,Resources,A curated list of awesome places to learn and/or practice algorithms,https://github.com/tayllan/awesome-algorithms),
AI,Resources, HN site for [ML,http://news.startup.ml/),
AI,HMM,DynamicDiscreteModels.jl,https://github.com/BenConnault/DynamicDiscreteModels.jl,Inference for partially observed Markov chains.
AI,HMM,HiddenMarkovModels.jl,https://github.com/BenConnault/HiddenMarkovModels.jl,Basic inference with Hidden Markov Models.
AI,HMM,RustModels.jl,https://github.com/BenConnault/RustModels.jl,Dynamic Discrete Choice Models with or without unobserved state variables.
AI,NEURALNETWORKS,ANN.jl,https://github.com/EricChiang/ANN.jl,Artifical Neural Networks.
AI,NEURALNETWORKS,log post on [Neural networks and a dive into Julia,http://blog.yhathq.com/posts/julia-neural-networks.html,
AI,NEURALNETWORKS,Boltzmann.jl,https://github.com/dfdx/Boltzmann.jl,Restricted Boltzmann Machines and Deep Belief Networks in Julia
AI,NEURALNETWORKS,FANN.jl,https://github.com/gasagna/FANN.jl,A Julia wrapper for the Fast Artificial Neural Network Library (FANN).
AI,NEURALNETWORKS,hinton.jl,https://github.com/lepisma/hinton.jl,Create hinton diagrams in Julia. Hinton diagrams are used to visualize weight matrices in neural networks.
AI,NEURALNETWORKS,Julia_Neural_Network,https://github.com/nwenzel/Julia_Neural_Network,Basic Neural Network written in JuliaLang.
AI,NEURALNETWORKS,KUnet.jl,https://github.com/denizyuret/KUnet.jl,Neural network code based on Julia and CUDA.
AI,NEURALNETWORKS,mlpnnets.jl,https://github.com/tautologico/learning/blob/master/nnets/mlp/julia/mlpnnets.jl,Feed-forward MLP neural network implementation.
AI,NEURALNETWORKS,MultiLabelNeuralNetwork.jl,https://github.com/jperla/MultiLabelNeuralNetwork.jl,A simple feed-forward neural network for multi-label classification.
AI,NEURALNETWORKS,neural.jl,https://github.com/compressed/neural.jl,is a Julia implementation of a neural network, based on Sergio Fierens Ruby version.
AI,NEURALNETWORKS,NeuralNets.jl,https://github.com/anj1/NeuralNets.jl,Generic artificial neural networks in Julia.
AI,NEURALNETWORKS,neuralnetwork.jl,https://github.com/tomaskrehlik/neuralnetwork.jl,is an implementation of label neural network originally written for MATLAB/Octave by Andrew Ng for Coursera Machine Learning Class.
AI,NEURALNETWORKS,NeuralNetworks.jl,https://github.com/soumith/NeuralNetworks.jl,Various functions for Neural Networks implemented in Julia.
AI,NEURALNETWORKS,RecurrentNN.jl,https://github.com/Andy-P/RecurrentNN.jl,Deep RNN and LSTM in Julia.
AI,NEURALNETWORKS,RNN.jl,https://github.com/kzahedi/RNN.jl,Recurrent Neural Networks.
AI,NEURALNETWORKS,SimpleNets,https://github.com/rgehring/SimpleNets,Simple neural nets implementions in Julia.
AI,NEURALNETWORKS,SpikeNet.jl,https://github.com/damiendr/SpikeNet.jl,A spiking neural network simulator written in Julia.
AI,NEURALNETWORKS,StackedNets.jl,https://github.com/yarlett/StackedNets.jl,A simple interface to _deep_ stacks of neural network units that can be trained using gradient descent over defined error measures.
AI,Resources,log post on '[Chess position evaluation with convolutional neural network in Julia,http://int8.io/chess-position-evaluation-with-convolutional-neural-networks-in-julia/)',
AI,NLP,AdaGram.jl,https://github.com/sbos/AdaGram.jl,Adaptive Skip-gram implementation in Julia.
AI,NLP,allen,https://github.com/ninjin/allen,A syntacto-semantic natural language parser.
AI,NLP,DPL.jl,https://github.com/quxiaofeng/DPL.jl,Projective Dictionary Pair Learning - code for the paper S. Gu, L. Zhang, W. Zuo, and X. Feng, “Projective Dictionary Pair Learning for Pattern Classification,” In NIPS 20144. https://sites.google.com/site/shuhanggu/home
AI,NLP,GloVe.jl,https://github.com/domluna/GloVe.jl,Implements Global Word Vectors.
AI,NLP,GoodTuring.jl,https://github.com/JoFrhwld/GoodTuring.jl,A Julia implementation of Simple Good Turing smoothing, largely adapted from @maxbane.
AI,NLP,Jukai.jl,https://github.com/hshindo/Jukai.jl, Natural Language Processing Toolkit.
AI,NLP,JuliaParser.jl,https://github.com/jakebolewski/JuliaParser.jl,A rewrite of Julia's parser in Julia.
AI,NLP,KUparser.jl,https://github.com/denizyuret/KUparser.jl,Dependency parsing with word vectors.
AI,NLP,Languages.jl,https://github.com/johnmyleswhite/Languages.jl,A package for working with human languages.
AI,NLP,Levenshtein.jl,https://github.com/rawrgrr/Levenshtein.jl,Levenshtein distance between two strings.
AI,NLP,LTSV.jl,https://github.com/kshramt/LTSV.jl,Labeled Tab Separated Values (LTSV) parser.
AI,NLP,MeCab.jl,https://github.com/chezou/MeCab.jl,Julia binding of Japanese morphological analyzer MeCab.
AI,NLP,NGram.jl,https://github.com/remusao/NGram.jl,Implement the NGram model.
AI,NLP,ParserCombinator.jl,https://github.com/andrewcooke/ParserCombinator.jl,A parser combinator library.
AI,NLP,Parsimonious.jl,https://github.com/gitfoxi/Parsimonious.jl,A PEG parser generator.
AI,NLP,PEGParser.jl,https://github.com/abeschneider/PEGParser.jl,A PEG Parser for Julia with Packrat capabilties, inspired by pyparsing, parsimonious, boost::spirit, as well as several others.
AI,NLP,PyLexYacc.jl,https://github.com/iamed2/PyLexYacc.jl,An interface to Python Lex-Yacc package that uses reflection for most of its processing.
AI,NLP,SimpleParser.jl,https://github.com/ordovician/SimpleParser.jl,A very simple hackable parser and lexer for simple languages.
AI,NLP,Stemmers.jl,https://github.com/tanmaykm/Stemmers.jl,Interface for text stemmer implementations.
AI,NLP,Sumup.jl,https://github.com/remusao/Sumup.jl,Automatic multi-documents, multi-topics summarization based on topic extraction.
AI,NLP,Treekenize.jl,https://github.com/o-jasper/Treekenize.jl,Parser with beginners and enders and infix.
AI,NLP,Text.jl,https://github.com/mit-nlp/Text.jl,Numerous tools for text processing.
AI,NLP,TextAnalysis.jl,https://github.com/johnmyleswhite/TextAnalysis.jl,A Julia package for text analysis.
AI,NLP,TopicModels.jl,https://github.com/slycoder/TopicModels.jl),
AI,NLP,TOML.jl,https://github.com/pygy/TOML.jl,A TOML parser.
AI,NLP,Word2Vec.jl,https://github.com/weijianzhang/Word2Vec.jl,Julia interface to word2vec.
AI,[FiniteAutomata](https://en.wikipedia.org/wiki/Category:Finite_automata),FiniteStateMachine.jl,https://github.com/tinybike/FiniteStateMachine.jl,A simple Julia implementation of finite state machines.
AI,Japanese,MeCab.jl,https://github.com/chezou/MeCab.jl,Julia binding of Japanese morphological analyzer MeCab.
AI,Resources,Text-Benchmarks,http://matthewrocklin.com/blog/work/2014/01/13/Text-Benchmarks/,Comparing Python v. Clojure v. Julia performance in text-processing and dynamic collections.
AI,SPEECHRECOGNITION,MelGeneralizedCepstrums.jl,https://github.com/r9y9/MelGeneralizedCepstrums.jl,It provides a `mel generalized cepstrum` analysis for spectrum envelope estimation, which includes linear predicition, mel-cepstrum, generalized cepstrum and mel-generalized cepstrum analysis for Julia.
AI,SPEECHRECOGNITION,SpeechBase.jl,https://github.com/r9y9/SpeechBase.jl),
AI,SPEECHRECOGNITION,SPTK.jl,https://github.com/r9y9/SPTK.jl,A Julia wrapper for the Speech Signal Processing Toolkit (SPTK), based on the modified version of SPTK.
AI,SPEECHRECOGNITION,SynthesisFilters.jl,https://github.com/r9y9/SynthesisFilters.jl,Speech Synthesis Filters.
AI,SPEECHRECOGNITION,WORLD.jl,https://github.com/r9y9/WORLD.jl,A Julia wrapper for WORLD - a high-quality speech analysis, modification and synthesis system. WORLD provides a way to decompose a speech signal into: Fundamental frequency (F0), spectral envelope, excitation signal (or aperiodicy used in TANDEM-STRAIGHT), and re-synthesize a speech signal from these paramters. See here for the original WORLD.
Algorithms,ALGORITHMS,DataDecomposition.jl,https://github.com/trthatcher/DataDecomposition.jl,Data pre-processing algorithms.
Algorithms,ALGORITHMS,SimDistComp.jl,https://github.com/CUHK-MMLAB/SimDistComp.jl,A Julia framework to support the simulation of distributed computing algorithms.
Algorithms,AssociationRule,ARules.jl,https://github.com/toddleo/ARules.jl,Julia package for Association Rule Learning algorithms.
Algorithms,Checksum,CRC.jl,https://github.com/andrewcooke/CRC.jl,This is a Julia module for calculating Cyclic Redundancy Checksums (CRCs).
Algorithms,Checksum,CRC32.jl,https://github.com/fhs/CRC32.jl,32-bit cyclic redundancy check (CRC-32) checksum implementation.
Algorithms,CollaborativeFiltering,RecSys.jl,https://github.com/abhijithch/RecSys.jl,An implementation of the algorithm from Yunhong Zhou, Dennis Wilkinson, Robert Schreiber and Rong Pan. Large-Scale Parallel Collaborative Filtering for the Netflix Prize. Proceedings of the 4th international conference on Algorithmic Aspects in Information and Management. Shanghai, China pp. 337-348, 2008.
Algorithms,[SchedulingAlgorithm](https://en.wikipedia.org/wiki/Category:Scheduling_algorithms),HClust.jl,https://github.com/davidavdav/HClust.jl,Hierarchical Clustering for Julia, similar to R's hclust().
Algorithms,Quantum,AdiaRoll.jl,https://github.com/Roger-luo/AdiaRoll.jl,An Adiabatic Computation Simulator for quantum computation.
Algorithms,Quantum,Hadamard.jl,https://github.com/stevengj/Hadamard.jl,Fast multidimensional Walsh-Hadamard transforms.
Algorithms,PatternMatching,AhoCorasick.jl,https://github.com/gilesc/AhoCorasick.jl,Julia implementation of the Aho-Corasick algorithm for fast string searching.
Algorithms,PatternMatching,bfs.jl,https://github.com/adlawson/bfs.jl,Breadth First Search implementation in Julia.
Algorithms,PatternMatching,BlossomV.jl,https://github.com/mlewe/BlossomV.jl,An interface for the Blossom V perfect matching algorithm.
Algorithms,PatternMatching,dfs.jl,https://github.com/adlawson/dfs.jl,Depth First Search.
Algorithms,PatternMatching,ExpressionMatch.jl,https://github.com/MikeInnes/ExpressionMatch.jl,A small library designed to help macro writers deconstruct Julia expressions in a more declarative way without having to know in great detail how syntax is represented internally.
Algorithms,PatternMatching,JellyFish.jl,https://github.com/samuelcolvin/JellyFish.jl,Port of the jellyfish string comparison library.
Algorithms,PatternMatching,Loess.jl,https://github.com/dcjones/Loess.jl,is a loess implementation based on the fast kd-tree based approximation algorithm, a space-partitioning data structure for organizing points in a k-dimensional space.
Algorithms,PatternMatching,Match.jl,https://github.com/kmsquire/Match.jl,Advanced Pattern Matching for Julia.
Algorithms,PatternMatching,NearestNeighbors.jl,https://github.com/johnmyleswhite/NearestNeighbors.jl,Data structures for nearest neighbor search.
Algorithms,PatternMatching,ReverseRegexes.jl,https://github.com/carlobaldassi/ReverseRegexes.jl,Adds functionality to reverse-search strings with regexes
Algorithms,Sorting,NaturalSort.jl,https://github.com/simonster/NaturalSort.jl,Natural sort order.
Algorithms,Sorting,SearchSortAlgos.jl,https://github.com/Dawny33/SearchSortAlgos.jl,An API for common search and sort algorithms.
Algorithms,Time,LabelPropagation.jl,https://github.com/afternone/LabelPropagation.jl,A fast, nearly linear time algorithm for detecting communtiy structure in networks.
Algorithms,RESOURCES,algo-book-julia,https://github.com/Alexander-N/algo-book-julia,Snippets from Problem Solving with Algorithms and Data Structures in Julia.
Algorithms,RESOURCES,study,https://github.com/codematician/study,A study of interesting algorithms.
Algorithms,[NP-complete](https://en.wikipedia.org/wiki/Category:NP-complete_problems),TravelingSalesmanHeuristics.jl,https://github.com/evanfields/TravelingSalesmanHeuristics.jl,Julia package for simple traveling salesman problem heuristics.
Algorithms,[SAT](https://en.wikipedia.org/wiki/Satisfiability_modulo_theories),dReal.jl,https://github.com/zenna/dReal.jl,Nonlinear SMT solving using dReal.
Algorithms,[SAT](https://en.wikipedia.org/wiki/Satisfiability_modulo_theories),PicoSAT.jl,https://github.com/jakebolewski/PicoSAT.jl,Provides Julia bindings to the popular SAT solver picosat by Armin Biere. It is based off the Python pycosat and Go pigosat bindings written by Ilan Schnell and Willam Schwartz.
Algorithms,[SAT](https://en.wikipedia.org/wiki/Satisfiability_modulo_theories),Z3.jl,https://github.com/zenna/Z3.jl,This is a Julia interface to Z3 - a high performance theorem prover developed at Microsoft Research. Z3 can solve satisfiability modulo theory (SMT) problems.
Algorithms,DATASTRUCTURES,ScikitLearn.jl,https://github.com/cstjean/ScikitLearn.jl,Julia implementation of the scikit-learn API.
Algorithms,DATASTRUCTURES,heatsheet for [choosing the right estimator,http://scikit-learn.org/stable/tutorial/machine_learning_map/),
Algorithms,DATASTRUCTURES,ScikitLearnBase.jl,https://github.com/cstjean/ScikitLearnBase.jl,Definition of the [ScikitLearn.jl](https://github.com/cstjean/ScikitLearn.jl) API.
Algorithms,Array-Matrix,ArrayIteration.jl,https://github.com/timholy/ArrayIteration.jl,Testing new ideas for array iteration.
Algorithms,Array-Matrix,ArrayViews.jl,https://github.com/JuliaArrays/ArrayViews.jl,A Julia package to explore a new system of array views.
Algorithms,Array-Matrix,ArrayViewsAPL.jl,https://github.com/timholy/ArrayViewsAPL.jl,Generic array-view type with APL indexing semantics.
Algorithms,Array-Matrix,AxisArrays.jl,https://github.com/JuliaArrays/AxisArrays.jl,Performant arrays where each dimension can have a named axis with values.
Algorithms,Array-Matrix,BandedMatrices.jl,https://github.com/ApproxFun/BandedMatrices.jl,A Julia package for representing banded matrices.
Algorithms,Array-Matrix,CatIndices.jl,https://github.com/JuliaArrays/CatIndices.jl,Julia package for indices-aware array concatenation and growth.
Algorithms,Array-Matrix,CategoricalArrays.jl,https://github.com/nalimilan/CategoricalArrays.jl,Arrays for working with categorical data (both nominal and ordinal) in Julia.
Algorithms,Array-Matrix,ChunkedArrays.jl,https://github.com/ChrisRackauckas/ChunkedArrays.jl,A package for increasing the performance of arrays generated.
Algorithms,Array-Matrix,EndpointRanges.jl,https://github.com/JuliaArrays/EndpointRanges.jl,Julia package for doing arithmetic on endpoints in array indexing.
Algorithms,Array-Matrix,FArrayMod.jl,https://github.com/alsam/FArrayMod.jl,provides the ability to use arbitrary starting indices for arrays in Julia programming language.
Algorithms,Array-Matrix,FlexibleArrays.jl,http://eschnett.github.io/FlexibleArrays.jl/,Multi-dimensional arrays with arbitrary upper and lower bounds that can be fixed or flexible. [Source Code](https://github.com/eschnett/FlexibleArrays.jl).
Algorithms,Array-Matrix,FreqTables.jl,https://github.com/nalimilan/FreqTables.jl,Frequency tables in Julia.
Algorithms,Array-Matrix,HMat.jl,https://github.com/YingzhouLi/HMat.jl,Hierarchical Matrix.
Algorithms,Array-Matrix,ImmutableArrays.jl,https://github.com/twadleigh/ImmutableArrays.jl,Statically-sized immutable vectors and matrices.
Algorithms,Array-Matrix,IndexedArrays.jl,https://github.com/garrison/IndexedArrays.jl,A data structure that acts like a Vector of unique elements allowing a quick lookup of the index of any vector element in the array.
Algorithms,Array-Matrix,JudyDicts.jl,https://github.com/tanmaykm/JudyDicts.jl,Judy Array for Julia.
Algorithms,Array-Matrix,julia-delayed-matrix,https://github.com/kk49/julia-delayed-matrix,Delayed processing of Vector / Matrix expression in Julia with various backends.
Algorithms,Array-Matrix,JSparse.jl,https://github.com/dmbates/JSparse.jl,A Julia implementation of functions in the CSparse and CXSparse libraries developed by Tim Davis.
Algorithms,Array-Matrix,RandomBandedMatrices.jl,https://github.com/dlfivefifty/RandomBandedMatrices.jl),
Algorithms,Array-Matrix,RangeArrays.jl,https://github.com/JuliaArrays/RangeArrays.jl,Efficient and convenient array data structures where the columns of the arrays are generated (on the fly) by Ranges.
