Space-Science,Org-[JuliaAstro](https://JuliaAstro.github.io),Cosmology.jl,https://github.com/JuliaAstro/Cosmology.jl,Cosmology library for Julia.
Space-Science,Org-[JuliaAstro](https://JuliaAstro.github.io),DustExtinction.jl,https://github.com/JuliaAstro/DustExtinction.jl,Models for the interstellar extinction due to dust.
Space-Science,Org-[JuliaAstro](https://JuliaAstro.github.io),ERFA.jl,https://github.com/JuliaAstro/ERFA.jl,Julia wrapper for liberfa.
Space-Science,Org-[JuliaAstro](https://JuliaAstro.github.io),WCS.jl,https://github.com/JuliaAstro/WCS.jl,Astronomical World Coordinate Systems library for Julia.
Space-Science,AstronomicalImaging,FITSIO.jl,https://github.com/JuliaAstro/FITSIO.jl,Flexible Image Transport System (FITS) support for Julia.
Statistics,Econometrics,copula.jl,https://github.com/floswald/copula.jl,Julia Copula package implements the gaussian AR1 copula.
Statistics,Econometrics,DynamicFactorModels.jl,https://github.com/joidegn/DynamicFactorModels.jl,Dynamic Factor Models for Julia.
Statistics,Econometrics,Dynare.jl,https://github.com/DynareTeam/Dynare.jl,This package aims at bringing to Julia some of the algorithms incorporated in Dynare, a platform for solving dynamic economic models.
Statistics,Econometrics,FredData.jl,https://github.com/micahjsmith/FredData.jl,Pull [data](https://research.stlouisfed.org/fred2/) from [FRED](https://en.wikipedia.org/wiki/Federal_Reserve_Economic_Data) directly into Julia.
Statistics,Econometrics,fund.jl,https://github.com/davidanthoff/fund.jl,An implementation of FUND in Julia.
Statistics,Econometrics,GARCH.jl,https://github.com/AndreyKolev/GARCH.jl,Generalized Autoregressive Conditional Heteroskedastic (GARCH) models for Julia.
Statistics,Econometrics,Gensys.jl,https://github.com/QuantEcon/Gensys.jl,A Julia version of Gensys (Sims 2000).
Statistics,Econometrics,GrowthModels,https://github.com/NYUEcon/GrowthModels,This is a repository that contains solutions to many growth models that are of the same class.
Statistics,Econometrics,Jconometrics.jl,https://github.com/adriantorrie/Jconometrics.jl,MATLAB to Julia port of Spatial Econometrics.
Statistics,Econometrics,Loss.jl,https://github.com/johnmyleswhite/Loss.jl,General functions for estimating loss functions inspired by Kaggle's release of code for many common metrics.
Statistics,Econometrics,QuantEcon.jl,https://github.com/QuantEcon/QuantEcon.jl,This package collects code for quantitative economic modeling. It is currently comprised of two main parts: 1. A toolbox of routines useful when doing economics and 2. Implementations of types and solution methods for common economic models.
Statistics,Econometrics,RuinProbability.jl,https://github.com/Hank-Qian/RuinProbability.jl,For calculating the ruin probability with real data under different claims models.
Statistics,Finance,AssetMgmt.jl,https://github.com/cgroll/AssetMgmt.jl,Asset Management.
Statistics,Finance,BigFinance.jl,https://github.com/jiahao/BigFinance.jl,Analysis of high frequency quantitative data.
Statistics,Finance,lashcrash-ui,https://github.com/shashi/flashcrash-ui,UI for `BigFinance.jl`.
Statistics,Finance,Bloomberg.jl,https://github.com/milktrader/Bloomberg.jl,Providing access to Bloomberg financial data in Julia.
Statistics,Finance,BusinessDays.jl,https://github.com/felipenoris/BusinessDays.jl,A highly optimized Business Days calculator written in Julia language. Also known as Working Days calculator.
Statistics,Finance,Currencies.jl,https://github.com/TotalVerb/Currencies.jl, Simple checked fixed-point currencies for Julia.
Statistics,Finance,CTechCommon.jl,https://github.com/tbreloff/CTechCommon.jl,Some functionality to be shared among packages.  {Usable: 4, Robust: 4, Active: 1}
Statistics,Finance,EodData.jl,https://github.com/adriantorrie/EodData.jl,Julia package for connecting to the [EodData.com XML Web Service](http://eoddata.com/products/webservice.aspx).
Statistics,Finance,FinMarkets.jl,https://github.com/imanuelcostigan/FinMarkets.jl,Describe and model financial markets objects using Julia.
Statistics,Finance,FinancialMarkets.jl,https://github.com/imanuelcostigan/FinancialMarkets.jl,Describe and model financial markets objects using Julia.
Statistics,Finance,FRED.jl,https://github.com/joidegn/FRED.jl,Package to read from the St. Louis Federal Reserve Bank API.
Statistics,Finance,InterestRates.jl,https://github.com/felipenoris/InterestRates.jl,Tools for Term Structure of Interest Rates calculation, aimed at the valuation of financial contracts, specially Fixed Income instruments, indexing and Term Structures.
Statistics,Finance,Ito.jl,https://github.com/aviks/Ito.jl,An open source toolkit for financial computing in Julia.
Statistics,Finance,LibTrading.jl,https://github.com/StefanKarpinski/LibTrading.jl,A wrapper for the libtrading library, an _open source API for high-performance, low-latency trading applications_.
Statistics,Finance,MarketStates.jl,https://github.com/milktrader/MarketStates.jl,Library of market states that aggregate market indicators to produce a market signal.
Statistics,Finance,MCInsurance.jl,https://github.com/mkriele/MCInsurance.jl,This Julia package provides multi-period Monte Carlo simulations for life insurance.
Statistics,Finance,OpenFiscaCore.jl,https://github.com/openfisca/OpenFiscaCore.jl,A port of OpenFisca-Core to Julia. This is the core module of OpenFisca, without GUI or country-specific code & data.
Statistics,Finance,OpenFiscaFrance.jl,https://github.com/openfisca/OpenFiscaFrance.jl,A port of OpenFisca-France to Julia, containing the formulas and parameters of the french tax-benefit system.
Statistics,Finance,Quandl.jl,https://github.com/milktrader/Quandl.jl,Julia api to Quandl open source financial, economic and social datasets.
Statistics,Finance,RobHood.jl,https://github.com/cndesantana/RobHood.jl,Open platform to investigate markets.
Statistics,Finance,SDE.jl,https://github.com/mschauer/SDE.jl,Simulation and inference for Ito processes and diffusions.
Statistics,Finance,stockMonitor.jl,https://github.com/krthkj/stockMonitor.jl,A module which constantly collects and performs analyses the stock market.
Statistics,Finance,TradingSystem.jl,https://github.com/milktrader/TradingSystem.jl,Quantitative trading framework in Julia.
Statistics,Finance,WorldBankDataTd.jl,https://github.com/JuliaFinMetriX/WorldBankDataTd.jl,Accessing World Bank Data.
Statistics,Finance,YStockData.jl,https://github.com/Algocircle/YStockData.jl,Fetch Data from Yahoo Finance.
Statistics,Finance,ZVSimulator.jl,https://github.com/scidom/ZVSimulator.jl,The ZVSimulator package provides a framework for assessing the zero variance (ZV) principle for Monte Carlo or random sampling via simulation.
Statistics,Org-[JuliaQuant](https://github.com/JuliaQuant),FinancialBlotter.jl,https://github.com/JuliaQuant/FinancialBlotter.jl,Financial Instruments and Accounting in Julia.
Statistics,Org-[JuliaQuant](https://github.com/JuliaQuant),FinanceStats.jl,https://github.com/JuliaQuant/FinanceStats.jl,An experimental sandbox of functions that implement common statistical methods in finance.
Statistics,Org-[JuliaQuant](https://github.com/JuliaQuant),Grist.jl,https://github.com/JuliaQuant/Grist.jl,Financial blotter.
Statistics,Org-[JuliaQuant](https://github.com/JuliaQuant),Timestamps.jl,https://github.com/JuliaQuant/Timestamps.jl,Immutable timestamped values.
Statistics,Org-[JuliaQuant](https://github.com/JuliaQuant),TradeModels.jl,https://github.com/JuliaQuant/TradeModels.jl,Modeling the allocation of resources to markets based on the restraints of objective functions.
Statistics,Org-[JuliaQuant](https://github.com/JuliaQuant),TradingLogic.jl,https://github.com/JuliaQuant/TradingLogic.jl,An attempt at a unified framework in Julia language for both event-driven backtesting and live trading. This package utilizes reactive programming elements implemented in `Reactive.jl`.
Statistics,Resources,QuantEcon.jl,https://github.com/QuantEcon/QuantEcon.jl,A repository that houses example code, applications and teaching material related to QuantEcon.
Statistics,Resources,Self-Study Plan for Becoming a Quantitative Developer,http://www.quantstart.com/articles/Self-Study-Plan-for-Becoming-a-Quantitative-Developer,
Statistics,Resources,log : [Julia introduction by Sébastien Villemot,http://econforge.github.io/posts/2014/juil./28/cef2014-julia/) at Computational in Economics and Finance (CEF) conference 2014 in Oslo,
Statistics,DATASCIENCE,DataScienceBestPractices,https://github.com/AllenDowney/DataScienceBestPractices,Supporting code for a video series on best practices for exploratory data analysis.
Statistics,OPERATIONSRESEARCH,CGRASP.jl,https://github.com/tautologico/CGRASP.jl,Continuous Greedy Randomized Adaptive Search Procedure (CGRASP), in Julia.
Statistics,OPERATIONSRESEARCH,CSDP.jl,https://github.com/joehuchette/CSDP.jl,Julia wrapper for the CSDP semidefinite programming solver.
Statistics,OPERATIONSRESEARCH,ConstraintProgramming.jl,https://github.com/dpsanders/ConstraintProgramming.jl, Calculates the feasible region for a set of real-valued inequalities with Julia.
Statistics,OPERATIONSRESEARCH,CutPools.jl,https://github.com/joehuchette/CutPools.jl,Pools of cutting planes for JuMP models.
Statistics,OPERATIONSRESEARCH,jlSimplex,https://github.com/mlubin/jlSimplex,Proof-of-concept implementation of the (dual) simplex algorithm for linear programming in Julia.
Statistics,OPERATIONSRESEARCH,jobshop,https://github.com/stefan-k/jobshop,The Jobshop (Open Shop Scheduling Problem (OSSP)) problem is solved with evolutionary strategies in Julia.
Statistics,OPERATIONSRESEARCH,MinFinder.jl,https://github.com/Ken-B/MinFinder.jl,The MinFinder algorithm to find all the minima for a differentiable function inside a bounded domain.
Statistics,OPERATIONSRESEARCH,OptimizationServices.jl,https://github.com/tkelman/OptimizationServices.jl,Julia interface to [COIN-OR Optimization Services](https://projects.coin-or.org/OS). This Julia package is intended to be an interface between `MathProgBase.jl` and COIN-OR Optimization Services (OS), translating between the Julia-expression-tree `MathProgBase` format for nonlinear objective and constraint functions and the Optimization Services instance Language (OSiL) XML-based optimization problem interchange format.
Statistics,OPERATIONSRESEARCH,Predictors.jl,https://github.com/dejakaymac/Predictors.jl,
Statistics,OPERATIONSRESEARCH,Ranking.jl,https://github.com/johnmyleswhite/Ranking.jl,Tools for ranking in Julia.
Statistics,OPERATIONSRESEARCH,RankStatistics.jl,https://github.com/korowjev/RankStatistics.jl,A package that implements rank-based statistics methods.
Statistics,OPERATIONSRESEARCH,RationalSimplex.jl,https://github.com/IainNZ/RationalSimplex.jl,Pure Julia implementation of the simplex algorithm.
Statistics,OPERATIONSRESEARCH,SemidefiniteProgramming.jl,https://github.com/daviddelaat/SemidefiniteProgramming.jl,This package provides a Julia interface for low-level modeling of semidefinite programming problems and for solving semidefinite programs with solvers such as SDPA and CSDP.
Statistics,OPERATIONSRESEARCH,TrafficAssignment.jl,https://github.com/chkwon/TrafficAssignment.jl,A package for traffic assignment that loads the network data and finds the user equilibrium traffic pattern.
Statistics,OPERATIONSRESEARCH,VRP,https://github.com/IainNZ/VRP,Vehicle Routing Problem (VRP) is a combinatorial optimization and integer programming problem.
Statistics,Resources,ORSoftwareTools2014,https://github.com/IainNZ/ORSoftwareTools2014,This is the repository for code/examples/instructions for the MIT course 15.S60 _Software Tools for Operations Research_.
Statistics,Resources,DG2012Tutorial.jl,https://github.com/johnmyleswhite/DG2012Tutorial.jl,Simple examples of SGD-style computations in Julia.
Statistics,Optimization,AMPLMathProgInterface.jl,https://github.com/mlubin/AMPLMathProgInterface.jl,Wrapper for MathProgBase.jl {see the `JuliaOpt` section below}.
Statistics,Optimization,AmplNLWriter.jl,https://github.com/JackDunnNZ/AmplNLWriter.jl, Julia interface to [AMPL-enabled solvers](http://ampl.com/products/solvers/all-solvers-for-ampl/).
Statistics,Optimization,AutomotiveDrivingModels.jl,https://github.com/tawheeler/AutomotiveDrivingModels.jl,For car encounter models.
Statistics,Optimization,BARON.jl,https://github.com/joehuchette/BARON.jl,A wrapper for the BARON mixed-integer nonlinear programming solver.
Statistics,Optimization,BilinearJuMP.jl,https://github.com/IainNZ/BilinearJuMP.jl,A JuMP extension for bilinear optimization problems.
Statistics,Optimization,BlackBoxOptim.jl,https://github.com/robertfeldt/BlackBoxOptim.jl,An experimental, work-in-progress global optimization framework for Julia, supporting both multi- and single-objective optimization problems, focused on (meta-)heuristic/stochastic algorithms (DE, PSO, CMA-ES etc).
Statistics,Optimization,BLOM.jl,https://github.com/tkelman/BLOM.jl,A Julia port of the Berkeley Library for Optimization Modeling (Work-In-Progress).
Statistics,Optimization,ConicNonlinearBridge.jl,https://github.com/mlubin/ConicNonlinearBridge.jl,Wrapper to solve conic optimization problems with derivative-based nonlinear solvers.
Statistics,Optimization,CPLEX.jl,https://github.com/joehuchette/CPLEX.jl,The CPLEX.jl package provides an interface for using IBM's CPLEX Optimizer™ from the Julia language. You cannot use CPLEX.jl without having purchased and installed a copy of CPLEX Optimizer™ from IBM. This package is available free of charge and in no way replaces or alters any functionality of IBM's CPLEX Optimizer product.
Statistics,Optimization,DDUS.jl,https://github.com/vgupta1/DDUS.jl,Data-driven Uncertainty Sets for the JuMPeR framework.
Statistics,Optimization,DReal.jl,https://github.com/zenna/DReal.jl,A Julia wrapper for Nonlinear SMT solving using  the dReal SMT solver.
Statistics,Optimization,ECOS.jl,https://github.com/jfsantos/ECOS.jl,Julia wrapper for the ECOS SOCP solver.
Statistics,Optimization,GeneticAlgorithms.jl,https://github.com/forio/GeneticAlgorithms.jl,is a lightweight framework that simplifies the process of creating genetic algorithms and running them in parallel.
Statistics,Optimization,JuliaCMAES,https://github.com/Staross/JuliaCMAES,CMA-ES port - a mix of the original minimal MATLAB implementation (purecmaes.m) and the full one (cmaes.m).
Statistics,Optimization,julia-nlopt,https://github.com/MetalNinjas/julia-nlopt,NLopt bindings for julia. {__NB: Not maintained for the current Julia releases__}.
Statistics,Optimization,JuMP.jl,https://github.com/IainNZ/JuMP.jl,Modelling language for Linear, Integer, and Quadratic Programming.
Statistics,Optimization,JuMPSupplement,https://github.com/mlubin/JuMPSupplement,Repository containing supplementary materials and code for _JuMP: A Modeling Language for Mathematical Optimization_ by I. Dunning, J. Huchette, and M. Lubin.
Statistics,Optimization,CMU-notebooks,https://github.com/joehuchette/CMU-notebooks,IJulia notebooks for the JuMP tutorial at CMU.
Statistics,Optimization,JuMPeR.jl,https://github.com/IainNZ/JuMPeR.jl,Julia for Mathematical Programming (JuMP) extension for Robust optimization.
Statistics,Optimization,JuMPTools.jl,https://github.com/IainNZ/JuMPTools.jl,Small helper functions for JuMP models.
Statistics,Optimization,Junquo.jl,http://github.com/IainNZ/Junquo.jl,stands for _JUlia Nonconvex QUadratically constrained quadratic program Optimizer_, a (mixed-integer) nonconvex quadratically constrained quadratic program (QCQP) solver.
Statistics,Optimization,LinearResponseVariationalBayes.jl,https://github.com/rgiordan/LinearResponseVariationalBayes.jl,Julia tools for building simple variational Bayes models with JuMP.
Statistics,Optimization,LossFuns.jl,https://github.com/lindahua/LossFuns.jl,An implementation of loss functions for empirical risk minimization.
Statistics,Optimization,LSQ.jl,https://github.com/davidlizeng/LSQ.jl,is a library that makes it easy to formulate and solve least-squares optimization problems with linear equality constraints.
Statistics,Optimization,Mayday.jl,https://github.com/rdeits/Mayday.jl,Sums-of-Squares optimization in Julia, powered by JuMP
Statistics,Optimization,Memoize.jl,https://github.com/simonster/Memoize.jl,Easy memoization for Julia.
Statistics,Optimization,MOpt.jl,https://github.com/floswald/MOpt.jl,Parallel derivative-free Moment Optimization for Julia.
Statistics,Optimization,Munkres.jl,https://github.com/FugroRoames/Munkres.jl,Munkres algorithm for the optimal assignment problem.
Statistics,Optimization,NEOS.jl,https://github.com/odow/NEOS.jl,A Julia interface for the NEOS Optimisation Server.
Statistics,Optimization,NLTester,https://github.com/IainNZ/NLTester,Code for benchmarks comparing AMPL, Julia, and YALMIP (MATLAB) for nonlinear modeling.
Statistics,Optimization,pikaia.jl,https://github.com/tmeits/pikaia.jl,Genetic Algorithms (GA's).
Statistics,Optimization,Polyopt.jl,https://github.com/MOSEK/Polyopt.jl,Julia package for polynomial optimization using semidefinite programming, with some [presentation notebooks](https://github.com/MOSEK/Polyopt.jl/tree/master/notebooks) of an optimization package.
Statistics,Optimization,ProfileView.jl,https://github.com/GlenHertz/ProfileView.jl,Interactive SVG flame graphs for analyzing/profiling. An HTML preview of the [SVG example](http://htmlpreview.github.io/?https://raw.github.com/GlenHertz/ProfileView.jl/master/readme_images/profile.svg)
Statistics,Optimization,ProxAlgs.jl,https://github.com/ahwillia/ProxAlgs.jl,Proximal algorithms for optimization in Julia.
Statistics,Optimization,Proximal.jl,https://github.com/johnmyleswhite/Proximal.jl,Translation of Parikh and Boyd code for proximal algorithms.
Statistics,Optimization,Quadprog.jl,https://github.com/harmeling/Quadprog.jl,A wrapper around Ipopt.jl to solve quadratic programming problems. This package provides the function quadprog which calls the Ipopt.jl library for Interior Point Nonlinear Optimization.
Statistics,Optimization,QuickCheck.jl,https://github.com/pao/QuickCheck.jl,is listed in METADATA and based on QuickCheck specification-based randomized tester for Julia.
Statistics,Optimization,scheduleCrew.jl,https://github.com/hugdiniz/scheduleCrew.jl),
Statistics,Optimization,StructJuMP.jl,https://github.com/joehuchette/StructJuMP.jl,A block-structured optimization framework for JuMP.
Statistics,Optimization,SCIP.jl,https://github.com/mlubin/SCIP.jl) by @mlubi,An optimization software for mixed-integer programs.
Statistics,Optimization,SCIP.jl,https://github.com/ryanjoneil/SCIP.jl) by @ryanjonei,A Julia interface to the SCIP solver.
Statistics,Optimization,SCS.jl,https://github.com/karanveerm/SCS.jl,Julia Wrapper for SCS (https://github.com/cvxgrp/scs).
Statistics,Optimization,simplex.jl,https://github.com/davidagold/simplex.jl,Practice project program that performs the simplex algorithm.
Statistics,Optimization,VinDsl.jl,https://github.com/jmxpearson/VinDsl.jl,A fast and furious domain-specific language for variational inference in Julia.
Statistics,Optimization,Xpress.jl,https://github.com/joaquimg/Xpress.jl,A package under development according to the FICO optimizer manual.
Statistics,[GeneticProgramming](https://en.wikipedia.org/wiki/Genetic_programming),CGP.jl,https://github.com/glesica/CGP.jl,Cartesian Genetic Programming (CGP) implemented in Julia.
Statistics,[GeneticProgramming](https://en.wikipedia.org/wiki/Genetic_programming),GaussDCA.jl,https://github.com/carlobaldassi/GaussDCA.jl,Multivariate Gaussian Direct Coupling Analysis for residue contact prediction in protein families.
Statistics,[GeneticProgramming](https://en.wikipedia.org/wiki/Genetic_programming),InformedDifferentialEvolution.jl,https://github.com/rened/InformedDifferentialEvolution.jl,Implementation of Differential Evolution with optional custom predictors.
Statistics,[GeneticProgramming](https://en.wikipedia.org/wiki/Genetic_programming),ParallelGenocop.jl,https://github.com/display-none/ParallelGenocop.jl,Parallel implementation of Genocop - a genetic algorithm for numerical optimization problems with linear constraints.
Statistics,[GeometricProgramming](https://en.wikipedia.org/wiki/Geometric_programming),JuGP.jl,https://github.com/mlubin/JuGP.jl,A prototype JuMP extension for geometric programming.
Statistics,Org-[JuliaOpt](http://juliaopt.org/),Cbc.jl,https://github.com/JuliaOpt/Cbc.jl,Julia interface to the mixed-integer linear programming solver Cbc via the CoinMP C library.
Statistics,Org-[JuliaOpt](http://juliaopt.org/),CoinOptServices.jl,https://github.com/JuliaOpt/CoinOptServices.jl, Julia interface to COIN-OR [Optimization Services](https://projects.coin-or.org/OS).
Statistics,Org-[JuliaOpt](http://juliaopt.org/),Convex.jl,https://github.com/JuliaOpt/Convex.jl,a Julia library for mathematical programming that makes it easy to formulate and fast to solve nonlinear convex optimization problems. It can use (nearly) any solver that complies with the MathProgBase interface, including Mosek, Gurobi, ECOS, SCS, and GLPK.
Statistics,Org-[JuliaOpt](http://juliaopt.org/),GLPKMathProgInterface.jl,https://github.com/JuliaOpt/GLPKMathProgInterface.jl,Interface between the GLPK.jl wrapper and MathProgBase.jl.
Statistics,Org-[JuliaOpt](http://juliaopt.org/),Gurobi.jl,https://github.com/JuliaOpt/Gurobi.jl,is a Julia interface for the Gurobi Optimizer, a [commercial optimization solver for a variety of mathematical programming problems](https://en.wikipedia.org/wiki/Gurobi), including linear programming (LP), quadratic programming (QP), quadratically constrained programming (QCP), mixed integer linear programming (MILP), mixed-integer quadratic programming (MIQP), and mixed-integer quadratically constrained programming (MIQCP).
Statistics,Org-[JuliaOpt](http://juliaopt.org/),Ipopt.jl,https://github.com/JuliaOpt/Ipopt.jl,is a Julia interface to the Ipopt nonlinear solver.
Statistics,Org-[JuliaOpt](http://juliaopt.org/),KNITRO.jl,https://github.com/JuliaOpt/KNITRO.jl,This package provides an interface for using the KNITRO solver from the Julia language, which can only be used after having purchased and installed a copy of KNITRO from Ziena Optimization.
Statistics,Org-[JuliaOpt](http://juliaopt.org/),LsqFit.jl,https://github.com/JuliaOpt/LsqFit.jl,Simple curve fitting functionality from Optim.jl has been moved into its own package.
Statistics,Org-[JuliaOpt](http://juliaopt.org/),MathProgBase.jl,https://github.com/JuliaOpt/MathProgBase.jl,Solver-independent functions (incl. linprog and mixintprog) and low-level interface for Mathematical Programming.
Statistics,Org-[JuliaOpt](http://juliaopt.org/),Mosek.jl,https://github.com/JuliaOpt/Mosek.jl,Interface to the Mosek solver in Julia.
Statistics,Org-[JuliaOpt](http://juliaopt.org/),NLopt.jl,https://github.com/JuliaOpt/NLopt.jl,Package to call the NLopt nonlinear-optimization library from the Julia language.
Statistics,Org-[JuliaOpt](http://juliaopt.org/),Optim.jl,https://github.com/JuliaOpt/Optim.jl,A basic optimization algorithms implementation.
Statistics,Org-JuliaOptimizers,AMD.jl,https://github.com/JuliaOptimizers/AMD.jl,Approximate Minimum Degree Ordering in Julia.
Statistics,Org-JuliaOptimizers,ampl.jl,https://github.com/JuliaOptimizers/ampl.jl,Julia interface to the AMPL Solver Library (ASL).
Statistics,Org-JuliaOptimizers,AmplNLReader.jl,https://github.com/JuliaOptimizers/AmplNLReader.jl,A Julia Interface to AMPL.
Statistics,Org-JuliaOptimizers,CUTEst.jl,https://github.com/JuliaOptimizers/CUTEst.jl,Julia interface for CUTEst, a fork of [CUTEst.jl](https://github.com/lpoo/CUTEst.jl) by @lpoo.
Statistics,Org-JuliaOptimizers,HSL.jl,https://github.com/JuliaOptimizers/HSL.jl,Julia interface to the HSL Mathematical Software Library.
Statistics,Org-JuliaOptimizers,Krylov.jl,https://github.com/JuliaOptimizers/Krylov.jl,A Julia Basket of Hand-Picked Krylov Methods.
Statistics,Org-JuliaOptimizers,LinearOperators.jl,https://github.com/JuliaOptimizers/LinearOperators.jl,Linear Operators for Julia.
Statistics,Org-JuliaOptimizers,NLP.jl,https://github.com/JuliaOptimizers/NLP.jl,A Data Structure for Optimization Problems in Julia.
Statistics,Org-JuliaOptimizers,NLPModels.jl,https://github.com/JuliaOptimizers/NLPModels.jl,An NLP Interface for JuMP Models.
Statistics,[RegressionAnalysis](https://en.wikipedia.org/wiki/Compressed_sensing),BestSubsetRegression.jl,https://github.com/IainNZ/BestSubsetRegression.jl,Implements algorithms for the best subset regression problem in Julia.
Statistics,[RegressionAnalysis](https://en.wikipedia.org/wiki/Compressed_sensing),FirthRegression.jl,https://github.com/simonster/FirthRegression.jl,Firth penalized logistic/Poisson regression.
Statistics,[RegressionAnalysis](https://en.wikipedia.org/wiki/Compressed_sensing),FLSA.jl,https://github.com/EQt/FLSA.jl,Computing the Fused LASSO Signal Approximator.
Statistics,[RegressionAnalysis](https://en.wikipedia.org/wiki/Compressed_sensing),HD.jl,https://github.com/mlakolar/HD.jl,High-dimensional tools.
Statistics,[RegressionAnalysis](https://en.wikipedia.org/wiki/Compressed_sensing),Lasso.jl,https://github.com/simonster/Lasso.jl,Lasso solvers for linear and generalized linear models.
Statistics,[RegressionAnalysis](https://en.wikipedia.org/wiki/Compressed_sensing),NonNegLeastSquares.jl,https://github.com/ahwillia/NonNegLeastSquares.jl,Some nonnegative least squares solvers in Julia.
Statistics,[RegressionAnalysis](https://en.wikipedia.org/wiki/Compressed_sensing),OutOfSampleBootstrap.jl,https://github.com/grayclhn/OutOfSampleBootstrap.jl,Regression model validation (out-of-sample) statistics.
