Computer-Graphics,Games,ReinforcementLearning.jl,https://github.com/benhamner/ReinforcementLearning.jl),
Computer-Graphics,Games,SFML.jl,https://github.com/zyedidia/SFML.jl,A binding of the Game and Multimedia Library SFML.
Computer-Graphics,Games,SpaceShooter.jl,https://github.com/zyedidia/SpaceShooter.jl,This is a small space shooter game made in Julia with SFML.jl
Computer-Graphics,Resources,julia-opengl-demos,https://github.com/ssfrr/julia-opengl-demos,A holding place for demos and tutorials as @ssfrr learns OpenGL in Julia, using GLFW.jl and OpenGL.jl.
Computer-Graphics,Resources,Videre,https://github.com/Gnimuc/Videre,OpenGL examples written in Julia.
Computer-Graphics,INFOGRAPHICS,AnimatedPlots.jl,https://github.com/zyedidia/AnimatedPlots.jl,Fast animated (and static) plots for Julia.
Computer-Graphics,INFOGRAPHICS,AverageShiftedHistograms.jl,https://github.com/joshday/AverageShiftedHistograms.jl,David Scott's Average Shifted Histogram density estimation.
Computer-Graphics,INFOGRAPHICS,BBVis.jl,https://github.com/joehuchette/BBVis.jl,Visualizations for branch-and-bound algorithms.
Computer-Graphics,INFOGRAPHICS,CData.jl,https://github.com/ma-laforge/CData.jl,C-Data Analysis/Visualization Suite.
Computer-Graphics,INFOGRAPHICS,ComposeVideo.jl,https://github.com/arnim/ComposeVideo.jl,Video generator for Gadfly.jl.
Computer-Graphics,INFOGRAPHICS,DC.jl,https://github.com/tawheeler/DC.jl,A Julia package for automagical DC.js linked charts in your IJulia notebook.
Computer-Graphics,INFOGRAPHICS,Displaz.jl,https://github.com/c42f/Displaz.jl,Julia bindings for [displaz](http://c42f.github.io/displaz), a cross platform las viewer application for displaying geospatial LiDAR data (point clouds and high level features deduced from such point clouds, and other geometry). The announcement on the [julia-dev ML by the core-dev ChrisFoster @c42f](https://groups.google.com/d/msg/julia-dev/qLdJTnLNQXU/mdTbMr1QhiMJ), also includes some installation instructions, which uses OpenGL display.
Computer-Graphics,INFOGRAPHICS,ECharts.jl,https://github.com/wlbksy/ECharts.jl) by @wlbks,Julia package for [ECharts](https://github.com/ecomfe/echarts)
Computer-Graphics,INFOGRAPHICS,ECharts.jl,https://github.com/randyzwitch/ECharts.jl) by @randyzwitc,Julia package for the ECharts visualization library.
Computer-Graphics,INFOGRAPHICS,GainPatterns.jl,https://github.com/dressel/GainPatterns.jl,This package allows manipulation of gain patterns. A gain pattern is a collection of gains (or strengths) versus angle. If you have a vector of angles, and a vector of gains taken at these angles, you can create a GainPattern, then create publication-ready plots of these gain patterns using PGF with the GainPatternsTex.jl package.
Computer-Graphics,INFOGRAPHICS,GainPatternsTex.jl,https://github.com/dressel/GainPatternsTex.jl,Plotting gain patterns.
Computer-Graphics,INFOGRAPHICS,GL.jl,https://github.com/jayschwa/GL.jl,Experimental OpenGL bindings for Julia.
Computer-Graphics,INFOGRAPHICS,GLAbstraction.jl,https://github.com/JuliaGL/GLAbstraction.jl,Abstraction library for OpenGL.
Computer-Graphics,INFOGRAPHICS,GLWindow.jl,https://github.com/JuliaGL/GLWindow.jl,Simple package to create an OpenGL window with an OpenGL context.
Computer-Graphics,INFOGRAPHICS,GR,https://github.com/jheinen/gr) framewor,A graphics library for visualisation applications. {{Has Julia routines compatible with the current ver0.4-stable release}}
Computer-Graphics,INFOGRAPHICS,GracePlot.jl,https://github.com/ma-laforge/GracePlot.jl,Publication-quality plotting for julia using Grace/xmgrace.
Computer-Graphics,INFOGRAPHICS,GraphCentrality.jl,https://github.com/sbromberger/GraphCentrality.jl,All centrality measures relating to graphs for degree (with indegree and outdegree), betweenness, and closeness centrality measures.
Computer-Graphics,INFOGRAPHICS,GraphPlot.jl,https://github.com/afternone/GraphPlot.jl,Graph visualization for Julia.
Computer-Graphics,INFOGRAPHICS,GraphVisualize.jl,https://github.com/JuliaGraphs/GraphVisualize.jl,Graph visualization with tight integration with LightGraphs.jl package.
Computer-Graphics,INFOGRAPHICS,GraphViz.jl,https://github.com/Keno/GraphViz.jl,Julia bindings for the GraphViz library.
Computer-Graphics,INFOGRAPHICS,HEALPix.jl,https://github.com/mweastwood/HEALPix.jl,Julia wrapper for [HEALPix](http://healpix.jpl.nasa.gov/).
Computer-Graphics,INFOGRAPHICS,Histograms.jl,https://github.com/jpata/Histograms.jl,Methods for handling histograms in Julia.
Computer-Graphics,INFOGRAPHICS,julia-glplot,https://github.com/o-jasper/julia-glplot,Opengl plotting - Plotting of arrays, functions, Histograms, oscilloscope style real-time plotter.
Computer-Graphics,INFOGRAPHICS,Lumira.jl,https://github.com/sbcd90/Lumira.jl,A Julia Library which helps in the creation of SAP-Lumira extensions using Gadfly.
Computer-Graphics,INFOGRAPHICS,MinMaxFilter.jl,https://github.com/codles/MinMaxFilter.jl,Lemire min max filter.
Computer-Graphics,INFOGRAPHICS,Plots.jl,https://github.com/tbreloff/Plots.jl,An API/interface and wrapper that sits above other plotting packages (backends) and gives the user simple, consistent, and flexible plotting commands. {Usable: 5, Robust: 4, Active: 5}
Computer-Graphics,INFOGRAPHICS,PlotRecipes.jl,https://github.com/JuliaPlots/PlotRecipes.jl,Assorted recipes to be used with `Plots.jl`.
Computer-Graphics,INFOGRAPHICS,PlotThemes.jl,https://github.com/pkofod/PlotThemes.jl),
Computer-Graphics,INFOGRAPHICS,RasterIO.jl,https://github.com/wkearn/RasterIO.jl,Simple Raster Formats for Julia.
Computer-Graphics,INFOGRAPHICS,RecipesBase.jl,https://github.com/JuliaPlots/RecipesBase.jl,Base package for defining transformation recipes on user types for Plots.jl
Computer-Graphics,INFOGRAPHICS,VennDiagrams.jl,https://github.com/binarybana/VennDiagrams.jl,Generate Venn diagrams in Julia using Compose.jl.
Computer-Graphics,INFOGRAPHICS,VennEuler.jl,https://github.com/HarlanH/VennEuler.jl,Generate area-proportional Venn/Euler diagrams in Julia.
Computer-Graphics,INFOGRAPHICS,VGPlot.jl,https://github.com/johnmyleswhite/VGPlot.jl,A knock-off of ggplot2 in Julia using Vega.
Computer-Graphics,INFOGRAPHICS,VTK.jl,https://github.com/timholy/VTK.jl,VTK bindings for the Julia language.
Computer-Graphics,INFOGRAPHICS,uliaDSP/[Wavelets.jl,https://github.com/JuliaDSP/Wavelets.jl,Fast Discrete Wavelet Transforms written in Julia.
Computer-Graphics,INFOGRAPHICS,omaskrehlik/[Wavelets.jl,https://github.com/tomaskrehlik/Wavelets.jl,Implementation of Wavelet methods in Julia.
Computer-Graphics,GraphicalPlotting,Bokeh.jl,https://github.com/bokeh/Bokeh.jl,Bokeh bindings for Julia.
Computer-Graphics,GraphicalPlotting,FalseColor.jl,https://github.com/ojwoodford/FalseColor.jl,A Julia package to turn gridded data into pretty images.
Computer-Graphics,GraphicalPlotting,Gadfly.jl,http://gadflyjl.org/,[Gadfly](https://github.com/dcjones/Gadfly.jl) is a statistical graphics plotting and data visualization system.
Computer-Graphics,GraphicalPlotting,Gaston.jl,https://github.com/mbaz/Gaston.jl,A julia front-end for gnuplot.
Computer-Graphics,GraphicalPlotting,GLPlot.jl,https://github.com/SimonDanisch/GLPlot.jl,Plotting for Julia with OpenGL.
Computer-Graphics,GraphicalPlotting,GoogleCharts.jl,https://github.com/jverzani/GoogleCharts.jl,The Julia interface to Google Chart Tools.
Computer-Graphics,GraphicalPlotting,paper,https://github.com/andrewcooke/paper,Crumpled paper - PDF plot in Julia.
Computer-Graphics,GraphicalPlotting,Plotly.jl,https://github.com/plotly/Plotly.jl,A Julia wrapper for the plot.ly REST API.
Computer-Graphics,GraphicalPlotting,PLplot.jl,https://github.com/wildart/PLplot.jl,A cross-platform software package for creating scientific plots.
Computer-Graphics,GraphicalPlotting,PyPlot.jl,https://github.com/stevengj/PyPlot.jl,Plotting for Julia based on matplotlib, pyplot.
Computer-Graphics,GraphicalPlotting,Qwt.jl,https://github.com/tbreloff/Qwt.jl,2D plotting, drawing, and GUIs using Qwt and Qt.  {Usable: 4, Robust: 3, Active: 1}
Computer-Graphics,GraphicalPlotting,Sparrow.jl,https://github.com/rennis250/Sparrow.jl,A Julia package for plotting that uses ctioga2 as a backend.
Computer-Graphics,GraphicalPlotting,Vega.jl,https://github.com/johnmyleswhite/Vega.jl,A Julia package for generating visualizations in Vega.
Computer-Graphics,GraphicalPlotting,VegaLite.jl,https://github.com/fredo-dedup/VegaLite.jl,This package provides access to the Vega-Lite high-level [visualization grammar](http://vega.github.io/vega-lite/) in Julia. It is a simpler version of the Vega grammar allowing smaller and more expressive chart specifications, intentionaly more limited than Vega, and parts of the VegaLite package (rendering functions, IJulia integration) are based on [Vega.jl](https://github.com/johnmyleswhite/Vega.jl).
Computer-Graphics,GraphicalPlotting,Visualizer.jl,https://github.com/grero/Visualizer.jl,A simple GUI for quickly panning through a collection of data.
Computer-Graphics,GraphicalPlotting,Winston.jl,https://github.com/nolta/Winston.jl,2D plotting for Julia.
Computer-Graphics,GraphicalPlotting,YT.jl,https://github.com/jzuhone/YT.jl,A Julia interface to the Python-based yt analysis toolkit. YT exposes a number of functionalities from yt.
Computer-Graphics,Non-GraphicalPlotting,ASCIIPlots.jl,https://github.com/johnmyleswhite/ASCIIPlots.jl,
Computer-Graphics,Non-GraphicalPlotting,Hinton.jl,https://github.com/ninjin/Hinton.jl,A small Julia library for generating Hinton diagrams. It supports standard vector graphics formats such as PNG, SVG, and PDF, as well as generating diagrams in a terminal with Unicode and colour support.
Computer-Graphics,Non-GraphicalPlotting,ImageTerm.jl,https://github.com/meggart/ImageTerm.jl,Julia functions to plot colorful maps in the terminal.
Computer-Graphics,Non-GraphicalPlotting,Sparklines.jl,https://github.com/mbauman/Sparklines.jl,A Julia implementation of spark: simple printing of unicode trendlines.
Computer-Graphics,Non-GraphicalPlotting,TextPlots.jl,https://github.com/sunetos/TextPlots.jl,Fancy terminal plotting for Julia using Braille characters.
Computer-Graphics,Non-GraphicalPlotting,UnicodePlots.jl,https://github.com/Evizero/UnicodePlots.jl,Unicode plotting for the REPL in Julia.
Computer-Graphics,Resources,eff Bezanson's [Colorimetry in an iJulia notebook,http://nbviewer.ipython.org/url/beowulf.csail.mit.edu/18.337/black%20body%20radiation.ipynb,
Computer-Graphics,Org-[JuliaGL](https://github.com/JuliaGL),GLFW.jl,https://github.com/JuliaGL/GLFW.jl,Julia interface to [GLFW](http://www.glfw.org/), a multi-platform library for creating windows with OpenGL contexts and managing input and events.
Computer-Graphics,Org-[JuliaGL](https://github.com/JuliaGL),GLVisualize.jl,https://github.com/JuliaGL/GLVisualize.jl,Visualization library written in Julia and OpenGL.
Computer-Graphics,Org-[JuliaGL](https://github.com/JuliaGL),Vulkan.jl,https://github.com/JuliaGPU/Vulkan.jl,Wrapper of Vulkan, Khronos next generation OpenGL API.
Computer-Graphics,Org-[JuliaGraphics](https://www.github.com/JuliaGraphics),ColorTypes.jl,https://github.com/JuliaGraphics/ColorTypes.jl,Color primitives for Julia, based on FixedSizeArrays.
Computer-Graphics,Org-[JuliaGraphics](https://www.github.com/JuliaGraphics),ColorVectorSpace.jl,https://github.com/JuliaGraphics/ColorVectorSpace.jl,This package is an add-on to ColorTypes, and provides fast mathematical operations for objects with types such as RGB and Gray - Treat colors as if they are n-vectors for the purposes of arithmetic.
Computer-Graphics,Org-[JuliaGraphics](https://www.github.com/JuliaGraphics),Immerse.jl,https://github.com/JuliaGraphics/Immerse.jl,Dive deeper into your data with interactive graphics.
Computer-Graphics,Org-[JuliaGeometry](https://github.com/JuliaGeometry),GeometricalPredicates.jl,https://github.com/JuliaGeometry/GeometricalPredicates.jl,Fast, robust 2D and 3D geometrical predicates on generic point types. Implementation follows algorithms described in the Arepo paper and used (for e.g.) in the Illustris Simulation.
Computer-Graphics,Org-[JuliaGeometry](https://github.com/JuliaGeometry),GeometryTypes.jl,https://github.com/JuliaGeometry/GeometryTypes.jl,Geometry types and for Julia, based on FixedSizeArrays.
Computer-Graphics,Org-[JuliaGeometry](https://github.com/JuliaGeometry),Meshes.jl,https://github.com/JuliaGeometry/Meshes.jl,Generation and manipulation of triangular meshes for a type of polygon mesh in computer graphics.
Computer-Graphics,Org-[JuliaGeometry](https://github.com/JuliaGeometry),OctTrees.jl,https://github.com/JuliaGeometry/OctTrees.jl,Fast quad and oct-trees.
Computer-Graphics,Org-[JuliaGeometry](https://github.com/JuliaGeometry),Orthotopes.jl,https://github.com/JuliaGeometry/Orthotopes.jl,A Julia package for creating n-dimensional _bounding boxes_, a.k.a __orthotopes__, which are generalizations of rectangles in arbitary dimensions that are useful for describing bounding boxes of geometrical primitives. It implements Allen's interval algebra for evaluating the relations between orthotopes.
Computer-Graphics,Org-[JuliaGeometry](https://github.com/JuliaGeometry),TetGen.jl,https://github.com/JuliaGeometry/TetGen.jl,TetGen wrapper.
Computer-Graphics,Org-[JuliaGeometry](https://github.com/JuliaGeometry),TriangleIntersect.jl,https://github.com/JuliaGeometry/TriangleIntersect.jl,Fast ray-triangle intersections for raytracing.
Computer-Graphics,Org-[JuliaGeometry](https://github.com/JuliaGeometry),VoronoiCells.jl,https://github.com/jlapeyre/VoronoiCells.jl,Manipulate Voronoi cells in 2D.
Computer-Graphics,Org-[JuliaGeometry](https://github.com/JuliaGeometry),VoronoiDelaunay.jl,https://github.com/JuliaGeometry/VoronoiDelaunay.jl,Fast robust Voronoi and Delaunay triangulations, using `GeometricalPredicates.jl` package.
Computer-Graphics,Org-[JuliaImages](https://github.com/JuliaImages/),ImagesCore.jl,https://github.com/JuliaImages/ImagesCore.jl,Julia types for representing images.
Computer-Graphics,Org-[JuliaImages](https://github.com/JuliaImages/),ImageCL.jl,https://github.com/JuliaImages/ImageCL.jl,Image processing with OpenCL.
Computer-Graphics,Org-[JuliaImages](https://github.com/JuliaImages/),ImageFeatures.jl,https://github.com/JuliaImages/ImageFeatures.jl,Image feature detection for Julia.
Computer-Graphics,Org-[JuliaIO](https://github.com/JuliaIO),MeshIO.jl,https://github.com/JuliaIO/MeshIO.jl,IO for Meshes.
Computer-Graphics,Org-[JuliaIO](https://github.com/JuliaIO),NRRD.jl,https://github.com/JuliaIO/NRRD.jl,Package for NRRD IO.
Computer-Graphics,Org-[JuliaIO](https://github.com/JuliaIO),WavefrontObj.jl,https://github.com/JuliaIO/WavefrontObj.jl,Wafefront Obj importer.
Computer-Graphics,Org-JuliaLang,Cairo.jl,https://github.com/JuliaLang/Cairo.jl,Bindings for the Cairo graphics library.
Computer-Graphics,Org-[JuliaOpenCV](https://github.com/JuliaOpenCV/),CVCore.jl,https://github.com/JuliaOpenCV/CVCore.jl,Core functionality.
Computer-Graphics,Org-[JuliaOpenCV](https://github.com/JuliaOpenCV/),CVImgCodecs.jl,https://github.com/JuliaOpenCV/CVImgCodecs.jl,Image file reading and writing
Computer-Graphics,Org-[JuliaOpenCV](https://github.com/JuliaOpenCV/),CVImgProc.jl,https://github.com/JuliaOpenCV/CVImgProc.jl,Image processing
Computer-Graphics,Org-[JuliaOpenCV](https://github.com/JuliaOpenCV/),CVHighGUI.jl,https://github.com/JuliaOpenCV/CVHighGUI.jl,High-level GUI.
Computer-Graphics,Org-[JuliaOpenCV](https://github.com/JuliaOpenCV/),CVVideoIO.jl,https://github.com/JuliaOpenCV/CVVideoIO.jl,Media I/O.
Computer-Graphics,Org-[JuliaOpenCV](https://github.com/JuliaOpenCV/),LibOpenCV.jl,https://github.com/JuliaOpenCV/LibOpenCV.jl,OpenCV library dependencies.
Computer-Graphics,Org-JuliaPlots,RecipesBase.jl,https://github.com/JuliaPlots/RecipesBase.jl,Base package for defining transformation recipes on user types for `Plots.jl`.
Computer-Graphics,Org-JuliaPlots,PlotRecipes.jl,https://github.com/JuliaPlots/PlotRecipes.jl,Assorted recipes to be used with Plots.jl
Computer-Graphics,Org-JuliaPlots,PlotUtils.jl,https://github.com/JuliaPlots/PlotUtils.jl,Generic helper algorithms for building plotting components
Computer-Graphics,Org-JuliaPlots,StatPlots.jl,https://github.com/JuliaPlots/StatPlots.jl,Statistical plotting recipes for Plots.jl
Computer-Graphics,Org-[SISL](https://github.com/sisl),PGFPlots.jl,https://github.com/sisl/PGFPlots.jl,Plotting tool that uses the LaTeX pgfplots package (built on top of TikZ) to produce plots. Short [tutorial](http://nbviewer.ipython.org/github/sisl/PGFPlots.jl/blob/master/doc/PGFPlots.ipynb) notebook.
Computer-Graphics,Org-[SISL](https://github.com/sisl),Smile.jl,https://github.com/sisl/Smile.jl,A Julia wrapper for the Smile C++ Structural Modeling, Inference, and Learning Engine for Bayesian & Influence Networks .
Computer-Graphics,Org-[SISL](https://github.com/sisl),TikzGraphs.jl,https://github.com/sisl/TikzGraphs.jl,Graph layout package using algorithms built into [PGF/TikZ 3.0+](http://www.ctan.org/pkg/pgf).
Computer-Graphics,Org-[SISL](https://github.com/sisl),TikzPictures.jl,https://github.com/sisl/TikzPictures.jl,Library interface to PGF/TikZ, that allows one to create PGF/TikZ pictures and images can be saved as PDF, SVG, and TEX. If using IJulia, it will output SVG images.
DataBase,API,D4M.jl,https://github.com/achen12/D4M.jl,A D4M module for Julia. [D4M](http://www.mit.edu/~kepner/D4M/) was developed in MATLAB by Dr Jeremy Kepner and his team at Lincoln Labs.
DataBase,API,DBI.jl,https://github.com/johnmyleswhite/DBI.jl,An abstract DBI interface to provide a database-independent API protocol that all database drivers can be expected to comply with.
DataBase,API,LevelDB.jl,https://github.com/jerryzhenleicai/LevelDB.jl,Julia interface to Google's LevelDB key value database.
DataBase,API,Memcache.jl,https://github.com/tanmaykm/Memcache.jl,Julia memcached client.
DataBase,API,ODBC.jl,https://github.com/quinnj/ODBC.jl,A low-level ODBC interface for the Julia programming language.
DataBase,API,Tabular Data I/O in Julia,http://randyzwitch.com/julia-import-data/,
DataBase,API,ViewDBI.jl,https://github.com/kmsquire/ViewDBI.jl,View-based DBI for Julia.
DataBase,[Distributed](https://en.wikipedia.org/wiki/Category:Distributed_data_stores)Storage,Accumulo.jl,https://github.com/JuliaDB/Accumulo.jl,Apache Accumulo client.
DataBase,SciDB,SciDB-Julia,https://github.com/Paradigm4/SciDB-Julia,The SciDB-Julia package allows users of Julia to interface with SciDB. The API follows the Julia convention and allows for using Julia language constructs in SciDB operations. SciDB is an [array DBMS](http://en.wikipedia.org/wiki/Array_DBMS) is an array database designed for multidimensional data management and analytics common to scientific applications.
DataBase,SciDB,TAQ,https://github.com/Paradigm4/TAQ,Example SciDB queries for finance trade and quote data.
DataBase,ENGINES,kyotocabinet.jl,https://github.com/tuzzeg/kyotocabinet.jl,Implementation of Kyoto Cabinet in Julia language.
DataBase,GraphDB,Neo4j.jl,https://github.com/glesica/Neo4j.jl,Messing around with building a Neo4j driver for Julia.
DataBase,HDF,EasyData.jl,https://github.com/ma-laforge/EasyData.jl,Simple/Fast(+HDF5) solution to writing datasets & plots to file.
DataBase,LMDB,LMDB.jl,https://github.com/wildart/LMDB.jl,A Julia wrapper interface to [Lightning Memory-Mapped Database](http://symas.com/mdb/) (LMDB) key-value embedded data store developed by Symas for the OpenLDAP Project.
DataBase,MongoDB,CMongo.jl,https://github.com/tenthdimension/CMongo.jl,Julia wrapper of the C Mongo Driver.
DataBase,MongoDB,LibBSON.jl,https://github.com/pzion/LibBSON.jl,libbson bindings for the Julia programming language.
DataBase,MongoDB,LibMongo.jl,https://github.com/pzion/LibMongo.jl,Mongo bindings for the Julia programming language.
DataBase,MongoDB,Mongo.jl,https://github.com/pzion/Mongo.jl,Mongo bindings for the Julia programming language.
DataBase,MongoDB,Mongo.jl,https://github.com/Lytol/Mongo.jl) {__UnMaintained__,Mongo bindings for the Julia programming language.
DataBase,Redis,Redis.jl,https://github.com/jkaye2012/Redis.jl,Pure Julia implementation of a Redis client (actively maintained).
DataBase,Redis,Redis.jl,https://github.com/msainz/Redis.jl,Pure Julia implementation of a Redis client, largely based on redis-py.
DataBase,MySQL,MariaDB.jl,https://github.com/Dynactionize/MariaDB.jl,A wrapper around the MariaDB C connector.
DataBase,MySQL,MySQL.jl,https://github.com/johnmyleswhite/MySQL.jl,MySQL DBI driver that uses the C MySQL API and obeys the DBI.jl protocol.
DataBase,MySQL,SQLAlchemy.jl,https://github.com/malmaud/SQLAlchemy.jl,Wrapper over Python's SQLAlchemy library.
DataBase,PostgreSQL,libpq.jl,https://github.com/iamed2/libpq.jl,A libpq interface for Julia.
DataBase,PostgreSQL,Postgres.jl,https://github.com/NCarson/Postgres.jl,Postgres database interface for the Julia language.
DataBase,SQLite,SQLite.jl,https://github.com/quinnj/SQLite.jl,Julia interface to the SQLite library with support for operations on DataFrames.
DataBase,SQLite,Sqlite3.jl,https://github.com/PeetV/Sqlite3.jl,A wrapper for the SQLite3 C API, to work with SQLite databases in Julia. Functions are included for reading and writing tables to (/from) DataFrames.
DataBase,Org-[JuliaDB](https://github.com/JuliaDB),DataStreams.jl,https://github.com/JuliaDB/DataStreams.jl,A Julia package to stream data.
DataBase,Org-[JuliaDB](https://github.com/JuliaDB),DBAPI.jl,https://github.com/JuliaDB/DBAPI.jl,A new database interface proposal.
DataBase,Org-[JuliaDB](https://github.com/JuliaDB),DBPerf.jl,https://github.com/JuliaDB/DBPerf.jl,The code repository that benchmarks all the Julia Database Drivers / Wrappers.
DataBase,Org-[JuliaDB](https://github.com/JuliaDB),DBDSQLite.jl,https://github.com/JuliaDB/DBDSQLite.jl,DBI-compliant driver for SQLite3.
DataBase,Org-[JuliaDB](https://github.com/JuliaDB),JDBC.jl,https://github.com/JuliaDB/JDBC.jl,Julia interface to Java database drivers.
DataBase,Org-[JuliaDB](https://github.com/JuliaDB),MySQL.jl,https://github.com/JuliaDB/MySQL.jl,Julia bindings and helper functions for MariaDB/MySQL C library.
DataBase,Org-[JuliaDB](https://github.com/JuliaDB),PostgreSQL.jl,https://github.com/JuliaDB/PostgreSQL.jl,PostgreSQL API.
DataBase,RESOURCES,log on [The Lesser Known Normal Forms of Database Design,http://www.johnmyleswhite.com/notebook/2014/09/10/the-lesser-known-normal-forms/,
Earth-Science,AERONAUTICS,Rotations.jl,https://github.com/ronisbr/Rotations.jl,Functions related to rotations of coordinate frames, angle2dcm, dcm2angle.
Earth-Science,AERONAUTICS,Quaternions.jl,https://github.com/forio/Quaternions.jl,A Julia module with quaternion and dual-quaternion functionality.
Earth-Science,[ECOLOGY](https://en.wikipedia.org/wiki/Category:Ecology),EcologicalNetwork.jl,https://github.com/PoisotLab/EcologicalNetwork.jl,Measure various aspects of the structure of ecological networks in Julia.
Earth-Science,[Agronomy](https://en.wikipedia.org/wiki/Category:Agronomy)and[ForestModelling](https://en.wikipedia.org/wiki/Category:Forest_modelling),LeafAreaIndex.jl,https://github.com/ETC-UA/LeafAreaIndex.jl,Package to calculate Leaf Area Index from Hemisperical Images.
Earth-Science,[Agronomy](https://en.wikipedia.org/wiki/Category:Agronomy)and[ForestModelling](https://en.wikipedia.org/wiki/Category:Forest_modelling),LAIscript,https://github.com/ETC-UA/LAIscript,scripts to automatically run LAI calculations with ODBC link to custom database.
Earth-Science,AquaticEcology,Iceberg.jl,https://github.com/njwilson23/Iceberg.jl,Ice-seawater interface calculations using level set methods.
Earth-Science,AquaticEcology,TEOS.jl,https://github.com/njwilson23/TEOS.jl,Julia wrapper for TEOS-10 Gibbs Seawater Oceanographic Toolbox.
Earth-Science,[GEOSTATISTICS](https://en.wikipedia.org/wiki/Geostatistics),Krige.jl,https://github.com/njwilson23/Krige.jl,Kriging estimators in Julia.
Earth-Science,[GEOSTATISTICS](https://en.wikipedia.org/wiki/Geostatistics),GeoStats.jl,https://github.com/juliohm/GeoStats.jl,Geostatistics in Julia.
Earth-Science,[GEOSTATISTICS](https://en.wikipedia.org/wiki/Geostatistics),GeoStatsImages.jl,https://github.com/juliohm/GeoStatsImages.jl,Training images for geostastical simulation.
Earth-Science,[GEOSTATISTICS](https://en.wikipedia.org/wiki/Geostatistics),ImageQuilting.jl,https://github.com/juliohm/ImageQuilting.jl,3D image quilting simulation.
Earth-Science,[CARTOGRAPHY](https://en.wikipedia.org/wiki/Category:Cartography),OpenStreetMapParser.jl,https://github.com/yeesian/OpenStreetMapParser.jl,This package provides basic functionality for parsing OpenStreetMap data in Julia, in the following file formats: [.osm (XML)](http://wiki.openstreetmap.org/wiki/OSM_XML) and [.pbf (binary)](http://wiki.openstreetmap.org/wiki/PBF_Format).
Earth-Science,[CARTOGRAPHY](https://en.wikipedia.org/wiki/Category:Cartography),Proj4.jl,https://github.com/FugroRoames/Proj4.jl,Julia wrapper for PROJ.4 cartographic projections library.
Earth-Science,[CARTOGRAPHY](https://en.wikipedia.org/wiki/Category:Cartography),PyProj.jl,https://github.com/kshramt/PyProj.jl, A Julia wrapper of PyProj, that performs cartographic transformations and geodetic computations.
Earth-Science,[GIS](https://en.wikipedia.org/wiki/Geographic_information_system),DtPlot.jl,https://github.com/dejakaymac/DtPlot.jl,
Earth-Science,[GIS](https://en.wikipedia.org/wiki/Geographic_information_system),EarthSphere.jl,https://github.com/cuevasclemente/EarthSphere.jl,A library for measuring approximate distance and location given latitudes and longitudes.
Earth-Science,[GIS](https://en.wikipedia.org/wiki/Geographic_information_system),FlowNetworks.jl,https://github.com/scheidan/FlowNetworks.jl,Types and function to represent hydrological flow networks.
Earth-Science,[GIS](https://en.wikipedia.org/wiki/Geographic_information_system),Gaia.jl,https://github.com/jsbj/Gaia.jl,Unified interface for observational datasets of the Earth's weather and climate.
